id,title,publisher,publication_date,doi,source_type,work_type,source_quartile,authors_affils,citations
85128902726,Controlling synchronization of gamma oscillations by astrocytic modulation in a model hippocampal neural network,Scientific Reports,2022-12-01,10.1038/s41598-022-10649-3,Journal,Article,1,"{'57189508849': ['Lobachevsky State University of Nizhni Novgorod'], '50061518600': ['Lobachevsky State University of Nizhni Novgorod'], '6603861723': ['Lobachevsky State University of Nizhni Novgorod'], '55328272900': ['Lobachevsky State University of Nizhni Novgorod', 'Innopolis University', 'Immanuel Kant Baltic Federal University']}",{}
85126143343,AI for next generation computing: Emerging trends and future directions,Internet of Things (Netherlands),2022-08-01,10.1016/j.iot.2022.100514,Journal,Review,-1,"{'57216940144': ['Queen Mary University of London'], '54394627800': ['Shenzhen Institute of Advanced Technology'], '7003921978': ['University of York'], '56872834000': ['The University of Waikato'], '6508251119': ['University of Birmingham'], '56469553900': ['RMIT University'], '57219976731': ['Queen Mary University of London'], '6603094693': ['Univerza v Ljubljani'], '57200185805': ['Tianjin University'], '57218390610': ['Machine Intelligence Research Labs (MIR Labs) - Scientific Network for Innovation and Research Excellence', 'Innopolis University'], '57219663862': ['Jackson School of Geosciences', 'Indian Institute of Tropical Meteorology'], '36976054900': ['The University of Texas at Austin', 'Dell Technologies'], '24080140200': ['Indian Institute of Technology Kharagpur'], '34267505000': ['University of Sharjah'], '9736080300': ['Department of Engineering'], '6701784634': ['Western University'], '8843325700': ['UNSW Sydney'], '6701361478': ['The University of Manchester'], '6701473617': ['Vienna University of Technology, Distributed Systems Group'], '7003659610': ['Cardiff University'], '8927203000': ['Technische Universität Wien'], '55148419500': ['Queen Mary University of London']}",{'2022': '1'}
85129920558,Strengthening preparedness against global health threats: A paradigm shift based on One Health approaches,One Health,2022-06-01,10.1016/j.onehlt.2022.100396,Journal,Article,1,"{'7004036512': ['Istituto Superiore Di Sanita'], '22956431200': ['Istituto Superiore Di Sanita'], '6701758447': ['Istituto Superiore Di Sanita'], '57682183600': ['Istituto Superiore Di Sanita'], '57210021231': ['Istituto Superiore Di Sanita'], '6701397435': ['Istituto Superiore Di Sanita'], '55838510693': ['Istituto Superiore Di Sanita'], '7003323884': ['Istituto Superiore Di Sanita'], '24768323900': ['Istituto Superiore Di Sanita'], '6603050234': ['Istituto Superiore Di Sanita'], '57192670033': ['Istituto Superiore Di Sanita'], '57680787100': ['Istituto Superiore Di Sanita'], '7103376879': ['Istituto Superiore Di Sanita'], '25649194900': ['Istituto Superiore Di Sanita'], '25522287900': ['Istituto Superiore Di Sanita'], '24171318600': ['Centro Universitario Internazionale'], '40661326300': ['Innopolis University'], '32867537600': ['UK Health Security Agency'], '57681903200': ['Institute for International Studies (ISPI)'], '6504083813': [""Alisei: Italy's Life Science Cluster""], '6701512954': ['Istituto Superiore Di Sanita']}",{}
85126040713,Non-linear stiffness behavior of planar serial robotic manipulators,Mechanism and Machine Theory,2022-06-01,10.1016/j.mechmachtheory.2022.104783,Journal,Article,2,"{'57191922086': ['Laboratoire des Sciences du Numérique de Nantes'], '37016245900': ['Innopolis University'], '6701582655': ['Laboratoire des Sciences du Numérique de Nantes', 'IMT Atlantique'], '6602989627': ['Laboratoire des Sciences du Numérique de Nantes', 'CNRS Centre National de la Recherche Scientifique']}",{}
85124165352,Astrocytes mediate analogous memory in a multi-layer neuron–astrocyte network,Neural Computing and Applications,2022-06-01,10.1007/s00521-022-06936-9,Journal,Article,1,"{'57219974710': ['Lobachevsky State University of Nizhni Novgorod', 'Sechenov First Moscow State Medical University'], '55314345300': ['Lobachevsky State University of Nizhni Novgorod', 'Institute of Applied Physics of the Russian Academy of Sciences', 'Samara State Medical University'], '57200324455': ['Lobachevsky State University of Nizhni Novgorod'], '7103103296': ['Lobachevsky State University of Nizhni Novgorod', 'Sechenov First Moscow State Medical University', 'University College London'], '7005605401': ['Lobachevsky State University of Nizhni Novgorod', 'Samara State Medical University', 'Innopolis University'], '7005285942': ['Lobachevsky State University of Nizhni Novgorod', 'University of Leicester'], '55328272900': ['Lobachevsky State University of Nizhni Novgorod', 'Innopolis University']}",{'2022': '1'}
85130266925,Extrapolation of Human Estimates of the Concreteness/ Abstractness of Words by Neural Networks of Various Architectures,Applied Sciences (Switzerland),2022-05-01,10.3390/app12094750,Journal,Article,2,"{'26665013000': ['Kazan Federal University'], '57195101229': ['Innopolis University']}",{}
85128557670,Stabilization of an unstable equilibrium of a balance platform due to short-term training,"Chaos, Solitons and Fractals",2022-05-01,10.1016/j.chaos.2022.112099,Journal,Article,1,"{'57518300600': ['Immanuel Kant Baltic Federal University', 'Innopolis University'], '55241932000': ['Innopolis University'], '54787609400': ['Immanuel Kant Baltic Federal University', 'Innopolis University'], '56359138000': ['Immanuel Kant Baltic Federal University', 'Innopolis University'], '35334432000': ['Immanuel Kant Baltic Federal University', 'Innopolis University'], '56572360300': ['Immanuel Kant Baltic Federal University', 'Innopolis University'], '6603156741': ['Immanuel Kant Baltic Federal University', 'Innopolis University'], '7005864666': ['Innopolis University', 'Universidad Politécnica de Madrid']}",{}
85128240009,Cumulant analysis in wavelet space for studying effects of aging on electrical activity of the brain,"Chaos, Solitons and Fractals",2022-05-01,10.1016/j.chaos.2022.112038,Journal,Article,1,"{'57223027715': ['Saratov State University', 'Regional Scientific and Educational Mathematical Center “Mathematics of Future Technologies”'], '7202328274': ['Saratov State University', 'Regional Scientific and Educational Mathematical Center “Mathematics of Future Technologies”'], '57192586726': ['Innopolis University', 'Immanuel Kant Baltic Federal University'], '16498801300': ['Innopolis University', 'Immanuel Kant Baltic Federal University'], '56359138000': ['Innopolis University', 'Immanuel Kant Baltic Federal University'], '54787609400': ['Innopolis University', 'Immanuel Kant Baltic Federal University'], '13105436400': ['Saratov State University'], '6603156741': ['Innopolis University', 'Immanuel Kant Baltic Federal University']}",{}
85126675060,Multi-landmark environment analysis with reinforcement learning for pelvic abnormality detection and quantification,Medical Image Analysis,2022-05-01,10.1016/j.media.2022.102417,Journal,Article,1,"{'57209140202': ['Sorbonne Universite', 'Innopolis University'], '57219621465': ['Innopolis University', 'University College Dublin'], '57220034167': ['Innopolis University'], '57210314945': ['Innopolis University', 'Public Hospital #2'], '6507696809': ['Univerza v Ljubljani'], '40761505000': ['Univerza v Ljubljani', 'Københavns Universitet']}",{}
85125102064,A new modified social engineering optimizer algorithm for engineering applications,Soft Computing,2022-05-01,10.1007/s00500-022-06837-y,Journal,Article,2,"{'57208797688': ['Machine Intelligence Research Labs (MIR Labs) - Scientific Network for Innovation and Research Excellence'], '57190337049': ['German University of Technology in Oman'], '36835614000': ['Bristol Business School'], '57218390610': ['Machine Intelligence Research Labs (MIR Labs) - Scientific Network for Innovation and Research Excellence', 'Innopolis University']}",{}
85130240150,Software Engineering and Filmmaking: A Literature Review,Frontiers in Computer Science,2022-04-29,10.3389/fcomp.2022.884533,Journal,Review,-1,"{'40661326300': ['Innopolis University'], '57221642707': ['Innopolis University'], '57697962500': ['Innopolis University'], '7004757466': ['Innopolis University']}",{}
85125712183,Calculation of magnetic force and torque between two arbitrarily oriented circular filaments using Kalantarov–Zeitlin's method,International Journal of Mechanical Sciences,2022-04-15,10.1016/j.ijmecsci.2022.107159,Journal,Article,1,"{'36626287100': ['Innopolis University', 'Karlsruher Institut für Technologie, Campus Nord']}",{}
85129255672,Bistability and Chaos Emergence in Spontaneous Dynamics of Astrocytic Calcium Concentration,Mathematics,2022-04-01,10.3390/math10081337,Journal,Article,2,"{'7004661122': ['Lobachevsky State University of Nizhni Novgorod', 'Samara State Medical University'], '57219973343': ['Lobachevsky State University of Nizhni Novgorod'], '55328272900': ['Lobachevsky State University of Nizhni Novgorod', 'Innopolis University'], '7005605401': ['Lobachevsky State University of Nizhni Novgorod', 'Samara State Medical University', 'Innopolis University']}",{}
85128840949,"Motor Imagery: How to Assess, Improve Its Performance, and Apply It for Psychosis Diagnostics",Diagnostics,2022-04-01,10.3390/diagnostics12040949,Journal,Review,4,"{'57491141600': ['Innopolis University'], '6603156741': ['Innopolis University', 'Immanuel Kant Baltic Federal University'], '35334432000': ['Innopolis University', 'Immanuel Kant Baltic Federal University']}",{}
85126800341,Age-Related Changes in Functional Connectivity during the Sensorimotor Integration Detected by Artificial Neural Network,Sensors,2022-04-01,10.3390/s22072537,Journal,Article,2,"{'57192586726': ['Immanuel Kant Baltic Federal University', 'Innopolis University'], '16498801300': ['Immanuel Kant Baltic Federal University', 'Innopolis University'], '55790267200': ['Immanuel Kant Baltic Federal University'], '6603156741': ['Immanuel Kant Baltic Federal University', 'Innopolis University']}",{}
85124817162,Optimization-Based Trajectory Tracking Approach for Multi-Rotor Aerial Vehicles in Unknown Environments,IEEE Robotics and Automation Letters,2022-04-01,10.1109/LRA.2022.3151157,Journal,Article,1,"{'57193419633': ['Innopolis University'], '57219973360': ['Innopolis University'], '57219857818': ['Innopolis University'], '37016245900': ['Innopolis University']}",{}
85122038269,A cooperative game theory approach for location-routing-inventory decisions in humanitarian relief chain incorporating stochastic planning,Applied Mathematical Modelling,2022-04-01,10.1016/j.apm.2021.12.023,Journal,Article,1,"{'57190337049': ['German University of Technology in Oman'], '57208797688': ['Machine Intelligence Research Labs (MIR Labs) - Scientific Network for Innovation and Research Excellence'], '8841811400': ['Universidad de Sevilla'], '57218390610': ['Machine Intelligence Research Labs (MIR Labs) - Scientific Network for Innovation and Research Excellence', 'Innopolis University']}",{}
85120943585,A reference architecture for social robots,Journal of Web Semantics,2022-04-01,10.1016/j.websem.2021.100683,Journal,Article,1,"{'57191745706': ['Alma Mater Studiorum Università di Bologna'], '7004218817': ['Alma Mater Studiorum Università di Bologna', 'Innopolis University'], '42862074000': ['Istituto Di Scienze E Tecnologie Della Cognizione, Rome'], '55885160000': ['Alma Mater Studiorum Università di Bologna', 'Istituto Di Scienze E Tecnologie Della Cognizione, Rome'], '57211808245': ['Istituto Di Scienze E Tecnologie Della Cognizione, Rome']}",{}
85118560753,Identification of elasto-static parameters of an industrial robot using monocular camera,Robotics and Computer-Integrated Manufacturing,2022-04-01,10.1016/j.rcim.2021.102276,Journal,Article,1,{'36069116200': ['Innopolis University']},{'2022': '1'}
85115440779,Elastostatic Modeling of Multi-Link Flexible Manipulator Based on Two-Dimensional Dual-Triangle Tensegrity Mechanism,Journal of Mechanisms and Robotics,2022-04-01,10.1115/1.4051789,Journal,Article,1,"{'57191922086': ['Laboratoire des Sciences du Numérique de Nantes'], '6701582655': ['IMT Atlantique'], '37016245900': ['Innopolis University'], '6602989627': ['CNRS Centre National de la Recherche Scientifique']}",{'2022': '2'}
85127671844,Morphing-Enabled Path Planning for Flying Tensegrity Robots as a Semidefinite Program,Frontiers in Robotics and AI,2022-03-14,10.3389/frobt.2022.812849,Journal,Article,2,"{'55978984900': ['Innopolis University'], '37016245900': ['Innopolis University']}",{}
85127420215,"Memory Modulation Via Non-invasive Brain Stimulation: Status, Perspectives, and Ethical Issues",Frontiers in Human Neuroscience,2022-03-04,10.3389/fnhum.2022.826862,Journal,Article,3,"{'40661326300': ['Innopolis University'], '24171318600': ['Centro Universitario Internazionale']}",{}
85127900674,"A Case Study on Handwritten Indic Script Classification: Benchmarking of the Results at Page, Block, Text-line, and Word Levels",ACM Transactions on Asian and Low-Resource Language Information Processing,2022-03-01,10.1145/3476102,Journal,Article,2,"{'57205269219': ['Jadavpur University'], '13607482600': ['Jadavpur University'], '57218390610': ['Machine Intelligence Research Labs (MIR Labs) - Scientific Network for Innovation and Research Excellence', 'Innopolis University'], '6603420429': ['Jadavpur University']}",{}
85126875535,Central pattern generator based on self-sustained oscillator coupled to a chain of oscillatory circuits,Chaos,2022-03-01,10.1063/5.0077789,Journal,Article,1,"{'35334432000': ['Immanuel Kant Baltic Federal University', 'Innopolis University'], '57217157705': ['Sirius University of Science and Technology', ""Kotel'nikov Institute of Radio Engineering and Electronics of Russian Academy of Sciences, Saratov Branch""], '35613865300': [""Kotel'nikov Institute of Radio Engineering and Electronics of Russian Academy of Sciences, Saratov Branch""], '7003520378': [""Kotel'nikov Institute of Radio Engineering and Electronics of Russian Academy of Sciences, Saratov Branch""], '23049013400': ['Lomonosov Moscow State University'], '6603156741': ['Immanuel Kant Baltic Federal University', 'Innopolis University', ""Kotel'nikov Institute of Radio Engineering and Electronics of Russian Academy of Sciences, Saratov Branch""]}",{}
85121650988,Differential exponential entropy-based multilevel threshold selection methodology for colour satellite images using equilibrium-cuckoo search optimizer,Engineering Applications of Artificial Intelligence,2022-03-01,10.1016/j.engappai.2021.104599,Journal,Article,1,"{'56446339200': ['Silicon Institute of Technology, Bhubaneswar'], '57383014700': ['VSS University of Technology'], '7102877360': ['VSS University of Technology'], '57197703328': ['VSS University of Technology'], '57218390610': ['Machine Intelligence Research Labs (MIR Labs) - Scientific Network for Innovation and Research Excellence']}",{'2022': '1'}
85126351373,Efficient use of secondary energy resources at an organic synthesis enterprise by the method of energy-technological combination,IOP Conference Series: Earth and Environmental Science,2022-02-25,10.1088/1755-1315/981/4/042022,Conference Proceeding,Conference Paper,4,"{'8872740700': ['Kazan National Research Technological University'], '57204840652': ['Kazan State Power Engineering University'], '57488160500': ['Innopolis University'], '57488160600': ['National Research University “Moscow Power Engineering Institute”'], '6506492062': ['Kazan National Research Technological University'], '55600224700': ['Kazan National Research Technological University'], '57207856961': ['Kazan National Research Technological University']}",{}
85130375582,On Approximation of Transition Densities in Calibration of 1-Dimensional Stochastic Models of Asset Prices,Lobachevskii Journal of Mathematics,2022-02-01,10.1134/S1995080222050183,Journal,Article,3,"{'57275276600': ['Sirius University of Science and Technology'], '57203576954': ['Innopolis University']}",{}
85130305509,An Approach for Formal Verification of Authentication Protocols,Lobachevskii Journal of Mathematics,2022-02-01,10.1134/S1995080222050195,Journal,Article,3,"{'57211752319': ['Innopolis University', 'Lomonosov Moscow State University']}",{}
85126261074,Recurrence Quantification Analysis of P300 Event-Related Potential on Single-Trial EEG,Bulletin of the Russian Academy of Sciences: Physics,2022-02-01,10.3103/S1062873822020241,Journal,Article,4,"{'57486254200': ['Innopolis University', 'Immanuel Kant Baltic Federal University']}",{}
85123234179,Dynamics of a ring of three fractional-order Duffing oscillators,"Chaos, Solitons and Fractals",2022-02-01,10.1016/j.chaos.2021.111747,Journal,Article,1,"{'57218999897': ['Universidad de Guadalajara'], '57204150648': ['Universidad de Guadalajara'], '8941071700': ['Universidad de Guadalajara'], '7005864666': ['Universidad Politécnica de Madrid', 'Innopolis University']}",{}
85122707146,Multi-type skin diseases classification using OP-DNN based feature extraction approach,Multimedia Tools and Applications,2022-02-01,10.1007/s11042-021-11823-x,Journal,Article,2,"{'57190252100': ['Indian Institute of Technology (Indian School of Mines), Dhanbad'], '57190977830': ['Indian Institute of Technology (Indian School of Mines), Dhanbad'], '57202970970': ['Indian Institute of Technology (Indian School of Mines), Dhanbad'], '57218390610': ['Machine Intelligence Research Labs (MIR Labs) - Scientific Network for Innovation and Research Excellence', 'Innopolis University']}",{}
85122078163,BUAKA-CS: Blockchain-enabled user authentication and key agreement scheme for crowdsourcing system,Journal of Systems Architecture,2022-02-01,10.1016/j.sysarc.2021.102370,Journal,Article,2,"{'55480987400': ['Graphic Era Deemed to be University'], '55450732800': ['International Institute of Information Technology, Hyderabad'], '35324500900': ['Innopolis University'], '57206866080': ['Thapar Institute of Engineering &amp; Technology'], '56591063600': ['Asansol Engineering College']}",{'2022': '1'}
85113696077,A Simple Physical Model for Control of a Propellerless Aquatic Robot,Journal of Mechanisms and Robotics,2022-02-01,10.1115/1.4051240,Journal,Article,1,"{'55929738700': ['Innopolis University', 'Kalashnikov Izhevsk State Technical University'], '55929695900': ['Kalashnikov Izhevsk State Technical University'], '6603881879': ['Kalashnikov Izhevsk State Technical University'], '6506350837': ['Kalashnikov Izhevsk State Technical University'], '55649445300': ['Udmurt State University']}",{'2021': '2'}
85102106213,Kinematic Identification of Industrial Robot Using End-Effector Mounted Monocular Camera Bypassing Measurement of 3-D Pose,IEEE/ASME Transactions on Mechatronics,2022-02-01,10.1109/TMECH.2021.3064916,Journal,Article,1,{'36069116200': ['Innopolis University']},{'2021': '1'}
85131226947,Towards AIDOaRt Objectives via Joint Model-based Architectural Effort,CEUR Workshop Proceedings,2022-01-01,,Conference Proceeding,Conference Paper,4,"{'57221684186': ['Softeam'], '24479058100': ['Softeam', 'Innopolis University'], '56989268300': ['Softeam'], '36052505500': ['Softeam']}",{}
85131143183,Class-incremental Learning using a Sequence of Partial Implicitly Regularized Classifiers,"Proceedings of the International Florida Artificial Intelligence Research Society Conference, FLAIRS",2022-01-01,10.32473/flairs.v35i.130549,Conference Proceeding,Conference Paper,-1,"{'57223668751': ['Innopolis University'], '57210847116': ['Innopolis University'], '57721565600': ['Innopolis University'], '56783838600': ['University of the West of England']}",{}
85130228618,A deep learning framework for vertebral morphometry and Cobb angle measurement with external validation,European Spine Journal,2022-01-01,10.1007/s00586-022-07245-4,Journal,Article,1,"{'57696755100': ['Innopolis University'], '57220034167': ['Innopolis University'], '57210314945': ['Innopolis University', 'Kazan Public Hospital'], '57698288100': ['Barsmed Diagnostic Center'], '40761505000': ['Københavns Universitet', 'Univerza v Ljubljani'], '6507696809': ['Univerza v Ljubljani']}",{}
85130039230,Message from Program Committee,ICCQ 2022 - Proceedings of the 2nd International Conference on Code Quality,2022-01-01,10.1109/ICCQ53703.2022.976329,Conference Proceeding,Editorial,-1,{'57687270200': ['Innopolis University']},{}
85129414398,Hybrid Dense Network With Attention Mechanism for Hyperspectral Image Classification,IEEE Journal of Selected Topics in Applied Earth Observations and Remote Sensing,2022-01-01,10.1109/JSTARS.2022.3171586,Journal,Article,1,"{'55232255600': ['National University of Computer and Emerging Sciences Islamabad'], '16679109100': ['Innopolis University'], '8557895400': ['Innopolis University'], '17433851100': ['Università degli Studi di Messina'], '56784776500': ['Jalpaiguri Government Engineering College'], '56108085300': ['Beijing University of Posts and Telecommunications']}",{}
85128774392,Object-Oriented Approach for Requirements Specification,CEUR Workshop Proceedings,2022-01-01,,Conference Proceeding,Conference Paper,4,"{'57224577783': ['Innopolis University', 'Université Fédérale Toulouse Midi-Pyrénées']}",{}
85128739255,A NLP Framework to Generate Video from Positive Comments in Youtube,Lecture Notes in Networks and Systems,2022-01-01,10.1007/978-3-030-99619-2_19,Book Series,Conference Paper,4,"{'57212008716': ['Innopolis University'], '8557895400': ['Innopolis University']}",{}
85128642050,Computing on Wheels: A Deep Reinforcement Learning-Based Approach,IEEE Transactions on Intelligent Transportation Systems,2022-01-01,10.1109/TITS.2022.3165662,Journal,Article,1,"{'56783838600': ['University of the West of England'], '57606989500': ['SYNCHROMEDIA-Multimedia Communication in Telepresence'], '57606989600': ['Hue University'], '57606453700': [""Queen's University Belfast""], '16679109100': ['Innopolis University'], '56565456500': ['Sejong University'], '57425027800': ['University of Massachusetts Dartmouth']}",{}
85128627218,Development of a Blockchain-Based Ad Listing Application,Lecture Notes in Networks and Systems,2022-01-01,10.1007/978-3-030-99584-3_4,Book Series,Conference Paper,4,"{'57212008716': ['Innopolis University'], '8557895400': ['Innopolis University'], '57606448200': ['Innopolis University'], '57606984800': ['Innopolis University'], '57608584700': ['Innopolis University']}",{}
85128198336,Automatic generation of a large dictionary with concreteness/abstractness ratings based on a small human dictionary,Journal of Intelligent and Fuzzy Systems,2022-01-01,10.3233/JIFS-219240,Journal,Article,3,"{'57195101229': ['Innopolis University'], '26665013000': ['Kazan Federal University']}",{}
85127707806,Metaheuristic Methods for Water Distribution Network Considering Routing Decision,Lecture Notes in Networks and Systems,2022-01-01,10.1007/978-3-030-96308-8_67,Book Series,Conference Paper,4,"{'57310244100': ['University of Kurdistan'], '57485384600': ['K. N. Toosi University of Technology'], '57224618331': ['Babol Noshirvani University of Technology'], '57563329800': ['Islamic Azad University'], '57218390610': ['Machine Intelligence Research Labs (MIR Labs) - Scientific Network for Innovation and Research Excellence', 'Innopolis University']}",{}
85127653863,Designing a Humanitarian Supply Chain for Pre and Post Disaster Planning with Transshipment and Considering Perishability of Products,Lecture Notes in Networks and Systems,2022-01-01,10.1007/978-3-030-96308-8_56,Book Series,Conference Paper,4,"{'57563468600': ['University of Tehran'], '57224620059': ['University of Tehran'], '56928367000': ['University of Tehran'], '56218703500': ['University of Tehran'], '57218390610': ['Machine Intelligence Research Labs (MIR Labs) - Scientific Network for Innovation and Research Excellence', 'Innopolis University']}",{}
85127200029,Vision System and Calibration,"Studies in Systems, Decision and Control",2022-01-01,10.1007/978-981-16-6990-3_2,Book Series,Book Chapter,4,"{'56099801900': ['Singapore University of Technology and Design'], '57143754800': ['Indian Institute of Technology Delhi'], '36069116200': ['Innopolis University'], '24829514800': ['Indian Institute of Technology (Indian School of Mines), Dhanbad'], '57337041000': ['Indian Institute of Technology Delhi'], '7403281143': ['Indian Institute of Technology Delhi'], '7005182122': ['Indian Institute of Technology Jodhpur']}",{}
85127177182,Identification,"Studies in Systems, Decision and Control",2022-01-01,10.1007/978-981-16-6990-3_4,Book Series,Book Chapter,4,"{'56099801900': ['Singapore University of Technology and Design'], '57143754800': ['Indian Institute of Technology Delhi'], '36069116200': ['Innopolis University'], '24829514800': ['Indian Institute of Technology (Indian School of Mines), Dhanbad'], '57337041000': ['Indian Institute of Technology Delhi'], '7403281143': ['Indian Institute of Technology Delhi'], '7005182122': ['Indian Institute of Technology Jodhpur']}",{}
85127151892,Integrated Assembly and Performance Evaluation,"Studies in Systems, Decision and Control",2022-01-01,10.1007/978-981-16-6990-3_6,Book Series,Book Chapter,4,"{'56099801900': ['Singapore University of Technology and Design'], '57143754800': ['Indian Institute of Technology Delhi'], '36069116200': ['Innopolis University'], '24829514800': ['Indian Institute of Technology (Indian School of Mines), Dhanbad'], '57337041000': ['Indian Institute of Technology Delhi'], '7403281143': ['Indian Institute of Technology Delhi'], '7005182122': ['Indian Institute of Technology Jodhpur']}",{}
