id,title,publisher,publication_date,doi,source_type,work_type,source_quartile,authors_affils,citations
85078763033,A PLS-SEM Neural Network Approach for Understanding Cryptocurrency Adoption,IEEE Access,2020-01-01,10.1109/ACCESS.2019.2960083,Journal,Article,2,"{'36440384900': ['University of Technology Sydney'], '56412522700': ['University of Technology Sydney'], '56448233700': ['National Textile University Faisalabad'], '55232255600': ['Khwaja Fareed University of Engineering &amp; Information Technology'], '8557895400': ['Innopolis University']}","{'2020': '2', '2021': '11', '2022': '11'}"
85078193289,About Controlling the Shape of the Sprinkler,"Studies in Systems, Decision and Control",2020-01-01,10.1007/978-3-030-37841-7_12,Book Series,Book Chapter,4,"{'6506125834': ['Volgograd State Technical University', 'Innopolis University'], '44161114000': ['Volgograd State Technical University', 'Innopolis University'], '57211559614': ['Volgograd State Technical University'], '35364441900': ['Volgograd State Technical University', 'Innopolis University']}",{}
85077491832,Oversampling Versus Variational Autoencoders: Employing Synthetic Data for Detection of Heracleum Sosnowskyi in Satellite Images,Lecture Notes in Electrical Engineering,2020-01-01,10.1007/978-981-15-1465-4_40,Book Series,Conference Paper,4,"{'57212930956': ['Innopolis University'], '16679109100': ['Innopolis University'], '35324500900': ['Innopolis University'], '57503974500': ['Kyung Hee University']}",{}
85076967235,Effect of Two Cracks in a Rotor on Stiffness Using the Theory of Fracture Mechanics,Lecture Notes in Mechanical Engineering,2020-01-01,10.1007/978-3-030-22041-9_98,Book Series,Conference Paper,4,"{'57210122026': ['Peter the Great St. Petersburg Polytechnic University'], '57197731584': ['Innopolis University'], '57212532485': ['Ministry of Oil, Republic of Iraq']}",{'2021': '1'}
85076728312,Minimization of Energy Costs for Movement Resistance of Ground for Walking Device by the Control of Support Points Motion,Lecture Notes in Mechanical Engineering,2020-01-01,10.1007/978-3-030-22063-1_89,Book Series,Conference Paper,4,"{'7103369607': ['Volgograd State Technical University'], '57191159808': ['Innopolis University'], '57194235342': ['Volgograd State Technical University']}",{'2021': '1'}
85075668172,Increasing Machining Accuracy of Industrial Manipulators Using Reduced Elastostatic Model,Lecture Notes in Electrical Engineering,2020-01-01,10.1007/978-3-030-31993-9_19,Book Series,Conference Paper,4,"{'57205663201': ['Innopolis University'], '57206536564': ['Innopolis University'], '57203955171': ['Innopolis University'], '37016245900': ['Innopolis University']}",{'2020': '1'}
85072902396,Algorithm to synthesize control force for tripod manipulator drives,"Smart Innovation, Systems and Technologies",2020-01-01,10.1007/978-981-13-9267-2_19,Book Series,Conference Paper,4,"{'6603217784': ['Volgograd State Technical University', 'Innopolis University'], '56593193500': ['Federal State Educational Institution of Higher Education, Volgograd State Agricultural University'], '57192145628': ['Federal State Educational Institution of Higher Education, Volgograd State Agricultural University'], '55514792100': ['Federal State Educational Institution of Higher Education, Volgograd State Agricultural University']}","{'2020': '2', '2021': '1'}"
85072896355,Admissible region ZMP trajectory generation for bipedal robots walking over uneven terrain,"Smart Innovation, Systems and Technologies",2020-01-01,10.1007/978-981-13-9267-2_11,Book Series,Conference Paper,4,"{'55978984900': ['Innopolis University'], '56895904700': ['Innopolis University'], '37016245900': ['Innopolis University']}",{'2021': '2'}
85072886388,Footstep planning for bipedal robots and lower limb exoskeletons moving through narrow doors,"Smart Innovation, Systems and Technologies",2020-01-01,10.1007/978-981-13-9267-2_7,Book Series,Conference Paper,4,"{'55978984900': ['Innopolis University'], '57191986976': ['Southwest State University'], '56512288300': ['Southwest State University']}",{}
85070011084,Natural human-robot interaction toolkit,Advances in Intelligent Systems and Computing,2020-01-01,10.1007/978-3-030-25629-6_31,Book Series,Conference Paper,-1,"{'57210234843': ['Innopolis University'], '57205614485': ['Innopolis University'], '57210232892': ['Innopolis University']}",{'2022': '1'}
85069985946,Exploration of underinvestigated indoor environment based on mobile robot and mixed reality,Advances in Intelligent Systems and Computing,2020-01-01,10.1007/978-3-030-25629-6_49,Book Series,Conference Paper,-1,"{'57210233068': ['Innopolis University'], '57204765694': ['Innopolis University'], '56088205500': ['Innopolis University'], '57203783042': ['Innopolis University'], '37016245900': ['Innopolis University']}",{'2022': '1'}
85065483507,Seeking Optimum System Settings for Physical Activity Recognition on Smartwatches,Advances in Intelligent Systems and Computing,2020-01-01,10.1007/978-3-030-17798-0_19,Book Series,Conference Paper,-1,"{'55232255600': ['Innopolis University', 'Università degli Studi di Messina'], '16679109100': ['Innopolis University'], '8557895400': ['Innopolis University'], '17433851100': ['Università degli Studi di Messina']}","{'2020': '3', '2021': '2'}"
85065469673,Comprising of elastostatic and elastodynamic modeling for compliance error compensation in bipedal robot,Lecture Notes in Electrical Engineering,2020-01-01,10.1007/978-3-030-11292-9_21,Book Series,Conference Paper,4,"{'57206536564': ['Innopolis University'], '37016245900': ['Innopolis University'], '57202156203': ['Innopolis University']}",{}
85065464687,Accident Recognition via 3D CNNs for Automated Traffic Monitoring in Smart Cities,Advances in Intelligent Systems and Computing,2020-01-01,10.1007/978-3-030-17798-0_22,Book Series,Conference Paper,-1,"{'57208663662': ['Innopolis University'], '16679109100': ['Innopolis University'], '26031517700': ['Zayed University'], '55232255600': ['Innopolis University']}","{'2019': '2', '2020': '1', '2021': '4', '2022': '1'}"
85064713686,Teaching Programming and Design-by-Contract,Advances in Intelligent Systems and Computing,2020-01-01,10.1007/978-3-030-11932-4_7,Book Series,Conference Paper,-1,"{'8634439300': ['Innopolis University'], '35324500900': ['Innopolis University'], '16679109100': ['Innopolis University'], '57200598144': ['Innopolis University'], '50262320700': ['Innopolis University'], '57205682636': ['Innopolis University'], '8557895400': ['Innopolis University'], '57200573284': ['Innopolis University'], '57190306849': ['Innopolis University'], '55303471000': ['Innopolis University']}",{'2020': '4'}
85064183861,Stance Prediction for Russian: Data and Analysis,Advances in Intelligent Systems and Computing,2020-01-01,10.1007/978-3-030-14687-0_16,Book Series,Conference Paper,-1,"{'57208223907': ['Innopolis University'], '55668121600': ['IT-Universitetet i København'], '8557895400': ['Innopolis University']}",{'2020': '1'}
85064182546,Preface,Advances in Intelligent Systems and Computing,2020-01-01,10.1016/j.entcom.2014.06.001,Book Series,Editorial,-1,"{'7004218817': ['Alma Mater Studiorum Università di Bologna'], '8557895400': ['Innopolis University'], '57118980100': ['Innopolis University'], '6602286710': ['Innopolis University'], '7004757466': ['Innopolis University']}",{}
85064182093,A Tool-Supported Approach for Building the Architecture and Roadmap in MegaM@Rt2 Project,Advances in Intelligent Systems and Computing,2020-01-01,10.1007/978-3-030-14687-0_24,Book Series,Conference Paper,-1,"{'24479058100': ['Innopolis University', 'SOFTEAM'], '36052505500': ['SOFTEAM'], '6508330976': ['Åbo Akademi University'], '57204767623': ['Intecs S.p.A.'], '27067480800': ['Laboratoire des Sciences du Numérique de Nantes'], '14050365600': ['Universitat Oberta de Catalunya'], '8963493600': ['Institució Catalana de Recerca i Estudis Avançats'], '56634917100': ['ATOS Spain SA'], '24832739300': ['Mälardalens högskola']}",{'2019': '1'}
85064176357,On the Parcellation of Functional Magnetic Resonance Images,Advances in Intelligent Systems and Computing,2020-01-01,10.1007/978-3-030-14687-0_29,Book Series,Conference Paper,-1,"{'57208163752': ['Lagos State University', 'Innopolis University'], '26660607700': ['Lagos State University'], '57208230099': ['Centre Européen de Recherches Nucléaires'], '8557895400': ['Innopolis University']}",{}
85064174122,Innopolis Going Global: Internationalization of a Young IT University,Advances in Intelligent Systems and Computing,2020-01-01,10.1007/978-3-030-14687-0_12,Book Series,Conference Paper,-1,"{'57208224127': ['Innopolis University'], '57208222713': ['Innopolis University'], '57205682636': ['Innopolis University'], '8557895400': ['Innopolis University'], '57118980100': ['Innopolis University'], '57192956419': ['Innopolis University']}",{'2020': '2'}
85064174035,Semantic Query Language for Temporal Genealogical Trees,Advances in Intelligent Systems and Computing,2020-01-01,10.1007/978-3-030-14687-0_9,Book Series,Conference Paper,-1,"{'57208228551': ['Innopolis University'], '8557895400': ['Innopolis University']}",{}
85064170989,Mapping Event-B Machines into Eiffel Programming Language,Advances in Intelligent Systems and Computing,2020-01-01,10.1007/978-3-030-14687-0_23,Book Series,Conference Paper,-1,"{'55303471000': ['Innopolis University'], '50262320700': ['Innopolis University'], '8557895400': ['Innopolis University']}","{'2019': '1', '2022': '1'}"
85064168289,"An Open-Source Software Metric Tool for Defect Prediction, Its Case Study and Lessons We Learned",Advances in Intelligent Systems and Computing,2020-01-01,10.1007/978-3-030-14687-0_7,Book Series,Conference Paper,-1,"{'57208225742': ['Innopolis University'], '57208222200': ['Innopolis University'], '7004757466': ['Innopolis University'], '55533068800': ['Innopolis University']}",{}
85064167859,Bi-lingual Intent Classification of Twitter Posts: A Roadmap,Advances in Intelligent Systems and Computing,2020-01-01,10.1007/978-3-030-14687-0_1,Book Series,Conference Paper,-1,"{'57208166212': ['Lagos State University', 'Innopolis University', 'Computer'], '50262320700': ['Innopolis University'], '57208226618': ['Lagos State University'], '8557895400': ['Innopolis University'], '26660607700': ['Lagos State University']}",{}
85064162043,Recruiting Software Developers a Survey of Current Russian Practices,Advances in Intelligent Systems and Computing,2020-01-01,10.1007/978-3-030-14687-0_10,Book Series,Conference Paper,-1,"{'57195101229': ['Innopolis University'], '57205682636': ['Innopolis University'], '57186538600': ['Innopolis University'], '7004757466': ['Innopolis University']}",{}
85064161189,Procedural Generation for Tabletop Games: User Driven Approaches with Restrictions on Computational Resources,Advances in Intelligent Systems and Computing,2020-01-01,10.1007/978-3-030-14687-0_5,Book Series,Conference Paper,-1,"{'55724408300': ['Innopolis University'], '56035821400': ['Syddansk Universitet']}",{'2019': '1'}
85064161187,Software Requirements Complexity Analysis to Support the “ADVISORY NETWORK IN TO THE NATION FORCES BUILD-UP”,Advances in Intelligent Systems and Computing,2020-01-01,10.1007/978-3-030-14687-0_17,Book Series,Conference Paper,-1,"{'57208230238': ['Università Cattolica del Sacro Cuore'], '57118980100': ['University of Innopolis'], '57191985261': ['Defense &amp; Security Software Engineers Association']}",{'2020': '1'}
85064158116,On the Time Performance of Automated Fixes,Advances in Intelligent Systems and Computing,2020-01-01,10.1007/978-3-030-14687-0_28,Book Series,Conference Paper,-1,{'55533068800': ['Innopolis University']},{}
85064154737,"Comparison of Agile, Quasi-Agile and Traditional Methodologies",Advances in Intelligent Systems and Computing,2020-01-01,10.1007/978-3-030-14687-0_11,Book Series,Conference Paper,-1,"{'57195101229': ['Innopolis University'], '57205682636': ['Innopolis University'], '57195995980': ['Innopolis University'], '7004757466': ['Innopolis University'], '6506906010': ['Innopolis University'], '55533068800': ['Innopolis University'], '57221974375': ['Innopolis University']}",{}
85064154279,Game Theoretic Framework to Mutation Testing,Advances in Intelligent Systems and Computing,2020-01-01,10.1007/978-3-030-14687-0_14,Book Series,Conference Paper,-1,{'50262320700': ['Innopolis University']},{}
85064152708,A Conjoint Application of Data Mining Techniques for Analysis of Global Terrorist Attacks: Prevention and Prediction for Combating Terrorism,Advances in Intelligent Systems and Computing,2020-01-01,10.1007/978-3-030-14687-0_13,Book Series,Conference Paper,-1,"{'57203288774': ['National University of Science &amp; Technology (MISIS)'], '8557895400': ['Innopolis University'], '57118980100': ['Innopolis University'], '50262320700': ['Innopolis University']}","{'2020': '3', '2022': '1'}"
85064152159,Hybrid Agile Software Development for Smart Farming Application,Advances in Intelligent Systems and Computing,2020-01-01,10.1007/978-3-030-14687-0_18,Book Series,Conference Paper,-1,"{'57118980100': ['University of Innopolis'], '57208228479': ['MTS Company']}",{}
85064149329,Affordance Theory Applied to Agile Development: A Case Study of LC2EVO,Advances in Intelligent Systems and Computing,2020-01-01,10.1007/978-3-030-14687-0_3,Book Series,Conference Paper,-1,"{'57193924846': ['Innopolis University'], '55724408300': ['Innopolis University'], '57118980100': ['Innopolis University']}",{'2020': '1'}
85064148461,Detection of Inconsistent Contracts Through Modular Verification,Advances in Intelligent Systems and Computing,2020-01-01,10.1007/978-3-030-14687-0_19,Book Series,Conference Paper,-1,"{'57190306849': ['Innopolis University', 'Université Fédérale Toulouse Midi-Pyrénées']}",{'2019': '1'}
85064009355,Expressing Trust with Temporal Frequency of User Interaction in Online Communities,Advances in Intelligent Systems and Computing,2020-01-01,10.1007/978-3-030-15032-7_95,Book Series,Conference Paper,-1,"{'57208165580': ['Innopolis University'], '57208163963': ['Innopolis University'], '50262320700': ['Innopolis University'], '8557895400': ['Innopolis University'], '57208166212': ['Lagos State University'], '57208163752': ['Lagos State University'], '24314788200': ['Technological University Dublin']}","{'2020': '1', '2021': '1', '2022': '1'}"
85064000251,Multilingual Entity Matching,Advances in Intelligent Systems and Computing,2020-01-01,10.1007/978-3-030-15032-7_68,Book Series,Conference Paper,-1,"{'57208160720': ['Innopolis University'], '35810198800': ['Schwarzthal Kapital', 'Labex ReFi'], '50262320700': ['Innopolis University']}",{'2020': '1'}
85086144617,Convex Optimization-based Motion Planner for Linear Variable Stiffness Actuators,ACM International Conference Proceeding Series,2019-12-12,10.1145/3387304.3387328,Conference Proceeding,Conference Paper,4,"{'55978984900': ['University Innopolis'], '57211506338': ['University Innopolis'], '37016245900': ['University Innopolis']}",{}
85119030128,Preface,Microservices: Science and Engineering,2019-12-11,,Book,Editorial,-1,"{'13105059800': ['Bruno Kessler Foundation'], '8308455900': ['Technical University of Denmark'], '6701473617': ['Vienna University of Technology, Distributed Systems Group'], '56187491900': ['Vrije Universiteit Amsterdam'], '8557895400': ['Innopolis University'], '55303471000': ['Innopolis University'], '24479058100': ['Innopolis University']}",{}
85078336103,The strength of the hull on a high longitudinal wave,IOP Conference Series: Materials Science and Engineering,2019-12-09,10.1088/1757-899X/666/1/012001,Conference Proceeding,Conference Paper,4,"{'57214156053': ['Peter the Great St. Petersburg Polytechnic University'], '57197731584': ['Innopolis University', 'Saba Saze Jonoub Shargh']}",{}
85078331330,Vibration analysis of skidding tractor with an operator during raising-lowering a tree,IOP Conference Series: Materials Science and Engineering,2019-12-09,10.1088/1757-899X/666/1/012007,Conference Proceeding,Conference Paper,4,"{'57197731584': ['Innopolis University', 'Peter the Great St. Petersburg Polytechnic University', 'Ministry of Oil, Republic of Iraq'], '57214145252': ['Peter the Great St. Petersburg Polytechnic University'], '57210122026': ['Peter the Great St. Petersburg Polytechnic University', 'Ministry of Oil, Republic of Iraq']}",{}
85078324692,Virtual non-contact atomic force microscope,IOP Conference Series: Materials Science and Engineering,2019-12-09,10.1088/1757-899X/666/1/012008,Conference Proceeding,Conference Paper,4,"{'57197731584': ['Innopolis University', 'Saba Saze Jonoub Shargh'], '57214156053': ['Peter the Great St. Petersburg Polytechnic University']}",{'2021': '2'}
85078323134,Investigation of cracked rotor analytically and numerically,IOP Conference Series: Materials Science and Engineering,2019-12-09,10.1088/1757-899X/666/1/012005,Conference Proceeding,Conference Paper,4,"{'57210122026': ['Peter the Great St. Petersburg Polytechnic University'], '57197731584': ['Innopolis University', 'Saba Saze Jonoub Shargh'], '57212532485': ['Ministry of Oil, Republic of Iraq']}",{}
85078295494,Motion control of self-driving vehicles on rough roads,IOP Conference Series: Materials Science and Engineering,2019-12-09,10.1088/1757-899X/707/1/012008,Conference Proceeding,Conference Paper,4,"{'57214700265': ['Innopolis University'], '56088205500': ['Innopolis University'], '37016245900': ['Innopolis University']}",{}
85078462350,Container-based sandboxes for malware analysis: A compromise worth considering,UCC 2019 - Proceedings of the 12th IEEE/ACM International Conference on Utility and Cloud Computing,2019-12-02,10.1145/3344341.3368810,Conference Proceeding,Conference Paper,-1,"{'55813715500': ['Innopolis University'], '57212083730': ['Innopolis University'], '35324500900': ['Innopolis University'], '56783838600': ['Innopolis University'], '55229307000': ['Innopolis University'], '55555819300': ['Royal Bank of Canada'], '57191513358': ['University of Derby'], '56405671800': ['Université de Ghardaia']}","{'2021': '4', '2022': '1'}"
85080914137,Platform-Independent Specification and Verification of the Standard Mathematical Square Root Function,Automatic Control and Computer Sciences,2019-12-01,10.3103/S0146411619070186,Journal,Article,4,"{'57211877255': ['Innopolis University'], '56502116300': ['A.P. Ershov Institute of Informatics Systems, Siberian Branch, Russian Academy of Sciences'], '6508263146': ['A.P. Ershov Institute of Informatics Systems, Siberian Branch, Russian Academy of Sciences', 'Institute of Automation and Electrometry of the Siberian Branch of the Russian Academy of Sciences'], '6507277018': ['A.P. Ershov Institute of Informatics Systems, Siberian Branch, Russian Academy of Sciences'], '14045680100': ['A.P. Ershov Institute of Informatics Systems, Siberian Branch, Russian Academy of Sciences']}",{}
85076482207,Enhanced label noise filtering with multiple voting,Applied Sciences (Switzerland),2019-12-01,10.3390/app9235031,Journal,Article,2,"{'14627276300': ['Nanjing University of Aeronautics and Astronautics'], '35213389000': ['Sejong University', 'Oakland University'], '22036893700': ['Nanjing University of Aeronautics and Astronautics'], '26031517700': ['Zayed University'], '36606049200': ['Innopolis University'], '54784481300': ['Kyung Hee University']}",{}
85076017158,Coherent resonance in the distributed cortical network during sensory information processing,Scientific Reports,2019-12-01,10.1038/s41598-019-54577-1,Journal,Article,1,"{'7005864666': ['Universidad Politécnica de Madrid', 'Innopolis University'], '56572360300': ['Innopolis University'], '57197756291': ['Innopolis University'], '16498801300': ['Innopolis University'], '56459531300': ['Innopolis University'], '36116363000': ['Innopolis University'], '55758753300': ['Innopolis University'], '6603156741': ['Innopolis University']}","{'2020': '11', '2021': '11', '2022': '7'}"
85074203597,Higher-order modes excitation in generator with photonic crystal,Results in Physics,2019-12-01,10.1016/j.rinp.2019.102758,Journal,Article,1,"{'56359138000': ['Innopolis University', 'Saratov State University'], '35334432000': ['Innopolis University', 'Saratov State University'], '16498801300': ['Innopolis University', 'Saratov State University'], '7004189995': ['Saratov State University'], '6603156741': ['Innopolis University'], '35192298600': ['Belarusian State University of Informatics and Radioelectronics']}","{'2020': '1', '2021': '1', '2022': '2'}"
85069654321,Integration of VANET and 5G Security: A review of design and implementation issues,Future Generation Computer Systems,2019-12-01,10.1016/j.future.2019.07.006,Journal,Article,1,"{'35324500900': ['Innopolis University'], '55555819300': ['Royal Bank of Canada'], '7003472739': ['University of Kentucky']}","{'2019': '1', '2020': '15', '2021': '18', '2022': '12'}"
85068778382,Visual and kinesthetic modes affect motor imagery classification in untrained subjects,Scientific Reports,2019-12-01,10.1038/s41598-019-46310-9,Journal,Article,1,"{'57202377690': ['Universidad Politécnica de Madrid'], '55774526600': ['Universidad Politécnica de Madrid', 'Universidad Politécnica de Madrid'], '56572360300': ['Innopolis University'], '35334432000': ['Innopolis University'], '16498801300': ['Innopolis University'], '57192586726': ['Innopolis University'], '6603156741': ['Innopolis University'], '7005864666': ['Universidad Politécnica de Madrid', 'Innopolis University']}","{'2019': '20', '2020': '29', '2021': '24', '2022': '2'}"
85068157512,Relaxation for online frequency estimator of bias-affected damped sinusoidal signals based on Dynamic Regressor Extension and Mixing,International Journal of Adaptive Control and Signal Processing,2019-12-01,10.1002/acs.3034,Journal,Article,2,"{'49664023200': ['Saint Petersburg National Research University of Information Technologies, Mechanics and Optics University ITMO'], '56405507900': ['Saint Petersburg State University'], '8046819200': ['Saint Petersburg National Research University of Information Technologies, Mechanics and Optics University ITMO', 'Innopolis University', 'Institute of Problems of Mechanical Engineering of the Russian Academy of Sciences'], '26656070700': ['Saint Petersburg National Research University of Information Technologies, Mechanics and Optics University ITMO', 'Hangzhou Dianzi University']}","{'2019': '1', '2020': '1', '2022': '1'}"
85067022256,GTSIM-POP: Game theory based secure incentive mechanism and patient-optimized privacy-preserving packet forwarding scheme in m-healthcare social networks,Future Generation Computer Systems,2019-12-01,10.1016/j.future.2019.05.079,Journal,Article,1,"{'56623561500': ['East China Normal University'], '7402432020': ['East China Normal University'], '7401797223': ['East China Normal University'], '57200495061': ['Innopolis University']}","{'2019': '1', '2020': '3', '2022': '2'}"
85065642812,Statistical Properties and Predictability of Extreme Epileptic Events,Scientific Reports,2019-12-01,10.1038/s41598-019-43619-3,Journal,Article,1,"{'16498801300': ['Innopolis University'], '54787609400': ['Innopolis University'], '56572360300': ['Innopolis University'], '35102865500': ['Westfälische Wilhelms-Universität Münster'], '56459531300': ['Innopolis University'], '7202328274': ['Yuri Gagarin State Technical University of Saratov'], '6701547705': ['Institute of Higher Nervous Activity and Neurophysiology of RAS'], '7005864666': ['Innopolis University', 'Universidad Politécnica de Madrid'], '35317963900': ['Potsdam Institut fur Klimafolgenforschung', 'Humboldt-Universität zu Berlin', 'Saratov State University'], '6603156741': ['Innopolis University']}","{'2019': '2', '2020': '13', '2021': '21', '2022': '3'}"
85057867081,ITS+DM Hackathon (ITSC 2017): Lane Departure Prediction with Naturalistic Driving Data,IEEE Intelligent Transportation Systems Magazine,2019-12-01,10.1109/MITS.2018.2880264,Journal,Article,1,"{'56734255800': ['Innopolis University', 'Institute of Computer Aided Design, Russian Academy of Sciences'], '57201856504': ['Technische Universität Darmstadt'], '23476702900': ['Toyota InfoTechnology Center'], '26421466600': ['Universidad de Las Palmas de Gran Canaria'], '6603023024': ['Nagoya University'], '55531799600': ['Nagoya University'], '7404334995': ['Nagoya University'], '13406373500': ['Nagoya University']}",{'2022': '2'}
85070891851,Interplay between Big Spectrum Data and Mobile Internet of Things: Current solutions and future challenges,Computer Networks,2019-11-09,10.1016/j.comnet.2019.106879,Journal,Article,1,"{'57210566014': ['Institute of Space Technology, Islamabad'], '35324500900': ['Innopolis University'], '55555819300': ['Royal Bank of Canada'], '48861413200': ['Institute of Space Technology, Islamabad']}","{'2019': '3', '2020': '1'}"
85082649524,A lightweight deep autoencoder-based approach for unsupervised anomaly detection,"Proceedings of IEEE/ACS International Conference on Computer Systems and Applications, AICCSA",2019-11-01,10.1109/AICCSA47632.2019.9035217,Conference Proceeding,Conference Paper,-1,"{'57216151508': ['Innopolis University'], '57216155841': ['Innopolis University'], '36606049200': ['Innopolis University']}","{'2021': '2', '2022': '1'}"
85081156824,Effect of Vibration on Twisted String Actuation Through Conduit at High Bending Angles,IEEE International Conference on Intelligent Robots and Systems,2019-11-01,10.1109/IROS40897.2019.8968212,Conference Proceeding,Conference Paper,2,"{'57215561465': ['School of Mechanical Engineering'], '24922859900': ['Innopolis University'], '7401867592': ['Korea Advanced Institute of Science and Technology']}","{'2021': '2', '2022': '2'}"
