id,title,publisher,publication_date,doi,source_type,work_type,source_quartile,authors_affils,citations
85073122417,The approach to the detection of the movement precursor by electromyographic signals,"ICINCO 2019 - Proceedings of the 16th International Conference on Informatics in Control, Automation and Robotics",2019-01-01,10.5220/0007916502760280,Conference Proceeding,Conference Paper,-1,"{'35334432000': ['Innopolis University'], '55241932000': ['Saratov State University'], '57192586726': ['Innopolis University'], '56572360300': ['Innopolis University'], '6603156741': ['Innopolis University']}",{'2021': '1'}
85073099391,A MEG study of different motor imagery modes in untrained subjects for BCI applications,"ICINCO 2019 - Proceedings of the 16th International Conference on Informatics in Control, Automation and Robotics",2019-01-01,10.5220/0007810001880195,Conference Proceeding,Conference Paper,-1,"{'6603156741': ['Innopolis University'], '57192586726': ['Innopolis University'], '57202377690': ['Universidad Politécnica de Madrid'], '56572360300': ['Innopolis University'], '16498801300': ['Innopolis University'], '35334432000': ['Innopolis University'], '7005864666': ['Innopolis University', 'Universidad Politécnica de Madrid']}","{'2020': '4', '2021': '2'}"
85072666135,Comparison of hybrid path planning approaches for vehicles in 3D non-deterministic environments,"International Journal of Modelling, Identification and Control",2019-01-01,10.1504/IJMIC.2019.102349,Journal,Article,2,"{'57216845296': ['Southern Federal University', 'Southern Federal University', 'Innopolis University'], '56688582900': ['Southern Federal University', 'Southern Federal University', 'Innopolis University'], '36998699500': ['Southern Federal University', 'Southern Federal University', 'Innopolis University'], '57214700265': ['Southern Federal University', 'Southern Federal University', 'Innopolis University'], '57274456400': ['Southern Federal University', 'Southern Federal University', 'Innopolis University']}",{}
85072312814,Stiffness modeling for anthropomorphic robots,Computer Research and Modeling,2019-01-01,10.20537/2076-7633-2019-11-4-631-651,Journal,Article,3,"{'57206536564': ['Innopolis University'], '37016245900': ['Innopolis University']}",{'2021': '1'}
85071695031,Predicting the results of evaluation procedures of academics,PeerJ,2019-01-01,10.7717/peerj-cs.199,Journal,Article,3,"{'55303032000': ['Alma Mater Studiorum Università di Bologna'], '7004218817': ['Alma Mater Studiorum Università di Bologna', 'Innopolis University'], '55605133800': ['Alma Mater Studiorum Università di Bologna'], '42862074000': ['Istituto Di Scienze E Tecnologie Della Cognizione, Rome'], '35183805200': ['Alma Mater Studiorum Università di Bologna'], '55885160000': ['Istituto Di Scienze E Tecnologie Della Cognizione, Rome']}","{'2019': '1', '2020': '2', '2021': '1', '2022': '1'}"
85071490175,"Design of a dashboard of software metrics for adaptable, energy efficient applications",Proceedings - DMSVIVA 2019: 25th International DMS Conference on Visualization and Visual Languages,2019-01-01,,Conference Proceeding,Conference Paper,-1,"{'57195101229': ['Innopolis University'], '57210797360': ['Innopolis University'], '57208466926': ['Innopolis University'], '7004757466': ['Innopolis University']}","{'2020': '1', '2021': '1'}"
85071385092,Integrating semantic run-time models for adaptive software systems,Journal of Web Engineering,2019-01-01,10.13052/jwe1540-9589.18131,Journal,Article,4,"{'55303032000': ['Alma Mater Studiorum Università di Bologna'], '57194011914': ['Alma Mater Studiorum Università di Bologna'], '7004218817': ['Alma Mater Studiorum Università di Bologna', 'Innopolis University']}","{'2019': '1', '2020': '3', '2021': '1'}"
85071376212,Initial evaluation of the brain activity under different software development situations,"Proceedings of the International Conference on Software Engineering and Knowledge Engineering, SEKE",2019-01-01,10.18293/SEKE2019-215,Conference Proceeding,Conference Paper,-1,"{'56433024700': ['Innopolis University'], '57195101229': ['Innopolis University'], '57205682636': ['Innopolis University'], '57210745781': ['Innopolis University'], '57210751133': ['Innopolis University'], '7004757466': ['Innopolis University'], '57210745306': ['Innopolis University'], '6506906010': ['Innopolis University'], '57210748512': ['Innopolis University']}","{'2020': '2', '2021': '3'}"
85069710508,Enterprise architecture modelling with ArchiMate,CEUR Workshop Proceedings,2019-01-01,,Conference Proceeding,Conference Paper,4,"{'57210149386': ['Softeam R and D Department'], '36052505500': ['Softeam R and D Department'], '16032247100': ['SINTEF Foundation for Scientific and Industrial Research'], '6602877737': ['SINTEF Foundation for Scientific and Industrial Research'], '6603082236': ['VTT Technical Research Centre of Finland'], '24479058100': ['Softeam R and D Department', 'Innopolis University']}",{}
85068998735,"Anomaly Detection, Analysis and Prediction Techniques in IoT Environment: A Systematic Literature Review",IEEE Access,2019-01-01,10.1109/ACCESS.2019.2921912,Journal,Review,2,"{'36606049200': ['Innopolis University'], '6602286710': ['Innopolis University']}","{'2019': '1', '2020': '9', '2021': '20', '2022': '8'}"
85068987964,Preface,IFIP Advances in Information and Communication Technology,2019-01-01,,Book Series,Editorial,4,"{'13106215800': ['École de Technologie Supérieure'], '6602286710': ['Innopolis University'], '55768623900': ['Universidade Federal de São Paulo'], '55348964400': ['Tampere University']}",{}
85068976073,Fifteen Years of Open Source Software Evolution,IFIP Advances in Information and Communication Technology,2019-01-01,10.1007/978-3-030-20883-7_6,Book Series,Conference Paper,4,"{'13106215800': ['École de Technologie Supérieure'], '55768623900': ['Universidade Federal de São Paulo'], '6602286710': ['Innopolis University']}",{}
85068584561,Use of artificial intelligence for study of the visual perception,Progress in Biomedical Optics and Imaging - Proceedings of SPIE,2019-01-01,10.1117/12.2527705,Conference Proceeding,Conference Paper,4,"{'55758753300': ['Innopolis University', 'Yuri Gagarin State Technical University of Saratov'], '56572360300': ['Innopolis University'], '36116363000': ['Innopolis University', 'Saratov State University']}",{}
85068579247,Detection of proepileptic activity patterns in EEG of WAG/Rij rats,Progress in Biomedical Optics and Imaging - Proceedings of SPIE,2019-01-01,10.1117/12.2527707,Conference Proceeding,Conference Paper,4,"{'54787609400': ['Innopolis University'], '6701547705': ['Institute of Higher Nervous Activity and Neurophysiology of RAS']}",{}
85068570045,Optical vector analyzer based on carrier-suppressed double-sideband modulation and phase-shift fiber Bragg grating,Proceedings of SPIE - The International Society for Optical Engineering,2019-01-01,10.1117/12.2527563,Conference Proceeding,Conference Paper,4,"{'7006896538': ['Kazan National Research Technical University named after A. N. Tupolev -KAI'], '6505707818': ['Kazan National Research Technical University named after A. N. Tupolev -KAI'], '56585905700': ['Kazan National Research Technical University named after A. N. Tupolev -KAI'], '56737120600': ['Kazan State Power Engineering University'], '57204903896': ['Innopolis University'], '57209739997': ['Kazan National Research Technical University named after A. N. Tupolev -KAI'], '57208836770': ['Kazan National Research Technical University named after A. N. Tupolev -KAI'], '57190849448': ['Kazan National Research Technical University named after A. N. Tupolev -KAI']}","{'2020': '1', '2021': '1'}"
85068567430,Mathematical simulation of coherent resonance phenomenon in a network of Hodgkin-Huxley biological neurons,Progress in Biomedical Optics and Imaging - Proceedings of SPIE,2019-01-01,10.1117/12.2527709,Conference Proceeding,Conference Paper,4,"{'57197756291': ['Innopolis University'], '7005864666': ['Innopolis University', 'Universidad Politécnica de Madrid']}","{'2019': '1', '2021': '1', '2022': '1'}"
85068566925,Pattern formation in spatially distributed networks via spatially correlated preferential attachment,Progress in Biomedical Optics and Imaging - Proceedings of SPIE,2019-01-01,10.1117/12.2527748,Conference Proceeding,Conference Paper,4,"{'57192586726': ['Innopolis University'], '56459531300': ['Innopolis University'], '7006291912': ['CNR - Institute of Complex Systems']}",{}
85068565386,Structural properties of brain functional network during Schulte table solving,Progress in Biomedical Optics and Imaging - Proceedings of SPIE,2019-01-01,10.1117/12.2527708,Conference Proceeding,Conference Paper,4,"{'57202153269': ['Innopolis University'], '56459531300': ['Innopolis University'], '36116363000': ['Innopolis University'], '55758753300': ['Innopolis University']}",{}
85068564882,Detection of EEG oscillatory patterns corresponding to human concentration of attention with help of perceptron type artificial neural network,Progress in Biomedical Optics and Imaging - Proceedings of SPIE,2019-01-01,10.1117/12.2527702,Conference Proceeding,Conference Paper,4,"{'54787609400': ['Innopolis University'], '16498801300': ['Innopolis University']}",{}
85068560489,Methods of assessing the degree of synchronization of multichannel EEG recordings,Progress in Biomedical Optics and Imaging - Proceedings of SPIE,2019-01-01,10.1117/12.2527706,Conference Proceeding,Conference Paper,4,"{'36116363000': ['Innopolis University', 'Saratov State University'], '55758753300': ['Innopolis University', 'Yuri Gagarin State Technical University of Saratov'], '6603156741': ['Innopolis University']}",{'2020': '1'}
85068554377,The investigation of synchronization between different areas of the brain in locomotor activity,Progress in Biomedical Optics and Imaging - Proceedings of SPIE,2019-01-01,10.1117/12.2527732,Conference Proceeding,Conference Paper,4,"{'36116363000': ['Innopolis University'], '55758753300': ['Innopolis University', 'Yuri Gagarin State Technical University of Saratov'], '57209731560': ['Saratov State Medical University named after V. I. Razumovsky']}",{}
85068549602,Study of EEG characteristics during the observation of an educational material,Progress in Biomedical Optics and Imaging - Proceedings of SPIE,2019-01-01,10.1117/12.2527696,Conference Proceeding,Conference Paper,4,"{'16498801300': ['Innopolis University'], '57209732384': ['Innopolis University'], '54787609400': ['Innopolis University'], '55758753300': ['Innopolis University'], '57202160289': ['Yuri Gagarin State Technical University of Saratov']}",{'2021': '1'}
85068549002,Artificial intelligence systems for classifying EEG responses to imaginary and real movements of operators,Progress in Biomedical Optics and Imaging - Proceedings of SPIE,2019-01-01,10.1117/12.2527730,Conference Proceeding,Conference Paper,4,"{'35334432000': ['Innopolis University'], '57192586726': ['Innopolis University'], '16498801300': ['Innopolis University']}","{'2019': '2', '2020': '6', '2021': '7', '2022': '1'}"
85068547352,Emergence of macroscopic chimera states in multilayer multiplex network,Progress in Biomedical Optics and Imaging - Proceedings of SPIE,2019-01-01,10.1117/12.2527692,Conference Proceeding,Conference Paper,4,{'57194146935': ['Innopolis University']},{}
85068545472,"The study of the correlation between EEG-EMG signals for the simple test ""fist-rib""/""palm-fist""",Progress in Biomedical Optics and Imaging - Proceedings of SPIE,2019-01-01,10.1117/12.2527735,Conference Proceeding,Conference Paper,4,"{'36116363000': ['Innopolis University', 'Saratov State University'], '55758753300': ['Innopolis University', 'Yuri Gagarin State Technical University of Saratov'], '57209731560': ['Saratov State Medical University named after V. I. Razumovsky']}",{}
85068544036,The study of the spatial distribution of non-invasive electromyographic signals on the front surface of a human hand arm during movement in the elbow joint,Progress in Biomedical Optics and Imaging - Proceedings of SPIE,2019-01-01,10.1117/12.2527734,Conference Proceeding,Conference Paper,4,"{'36116363000': ['Innopolis University'], '55758753300': ['Innopolis University', 'Saratov State Medical University named after V. I. Razumovsky'], '57209731560': ['Saratov State University', 'Yuri Gagarin State Technical University of Saratov']}",{}
85067579545,Stability of a Flexible Rotor-Bearing System with a Transverse Crack,Mechanisms and Machine Science,2019-01-01,10.1007/978-3-030-20131-9_332,Book Series,Conference Paper,4,"{'57209368335': ['Peter the Great St. Petersburg Polytechnic University'], '57197731584': ['Innopolis University'], '57209368128': ['Ministry of Oil, Republic of Iraq']}",{'2020': '1'}
85067516580,Automated measurement of technical debt: A systematic literature review,ICEIS 2019 - Proceedings of the 21st International Conference on Enterprise Information Systems,2019-01-01,10.5220/0007675900950106,Conference Proceeding,Conference Paper,-1,"{'57208746906': ['Innopolis University'], '56178226500': ['Innopolis University'], '57209341622': ['Innopolis University'], '6602286710': ['Innopolis University']}","{'2020': '1', '2021': '1'}"
85066796572,Recognizing human movements by processing EEG-signals using multiresolution analysis,Progress in Biomedical Optics and Imaging - Proceedings of SPIE,2019-01-01,10.1117/12.2511406,Conference Proceeding,Conference Paper,4,"{'57202318510': ['Yuri Gagarin State Technical University of Saratov'], '55758753300': ['Yuri Gagarin State Technical University of Saratov'], '13105436400': ['Saratov State University'], '7202328274': ['Yuri Gagarin State Technical University of Saratov', 'Saratov State University'], '6603156741': ['Yuri Gagarin State Technical University of Saratov', 'Innopolis University']}",{'2021': '1'}
85066439580,Prediction of reading difficulty in Russian academic texts,Journal of Intelligent and Fuzzy Systems,2019-01-01,10.3233/JIFS-179007,Journal,Article,3,"{'26665013000': ['Kazan Federal University'], '56429529500': ['Kazan Federal University'], '57195101229': ['Innopolis University'], '35606609300': ['Instituto Politécnico Nacional']}","{'2019': '1', '2020': '3', '2021': '6', '2022': '2'}"
85065723702,Multi-layer Extreme Learning Machine-based Autoencoder for Hyperspectral Image Classification,"VISIGRAPP 2019 - Proceedings of the 14th International Joint Conference on Computer Vision, Imaging and Computer Graphics Theory and Applications",2019-01-01,10.5220/0007258000750082,Conference Proceeding,Conference Paper,-1,"{'55232255600': ['Innopolis University', 'Università degli Studi di Messina'], '16679109100': ['Innopolis University'], '8557895400': ['Innopolis University'], '17433851100': ['Università degli Studi di Messina']}","{'2019': '1', '2020': '8', '2021': '7', '2022': '3'}"
85065670308,Ensemble trees learning based improved predictive maintenance using IIoT for turbofan engines,Proceedings of the ACM Symposium on Applied Computing,2019-01-01,10.1145/3297280.3297363,Conference Proceeding,Conference Paper,3,"{'57207835062': ['Indian Institute of Technology Patna'], '56425380600': ['Indian Institute of Technology Patna'], '57208767897': ['Indian Institute of Technology Patna'], '7203051070': ['Indian Institute of Technology Patna'], '57208735214': ['Indian Institute of Technology Patna'], '6602286710': ['Innopolis University']}","{'2020': '4', '2021': '4', '2022': '1'}"
85065654613,Extended sammon projection and wavelet kernel extreme learning machine for gait-based legitimate user identification,Proceedings of the ACM Symposium on Applied Computing,2019-01-01,10.1145/3297280.3297579,Conference Proceeding,Conference Paper,3,"{'55232255600': ['Università degli Studi di Messina', 'Innopolis University'], '17433851100': ['Università degli Studi di Messina'], '16679109100': ['Innopolis University'], '57216172919': ['Korea University'], '8557895400': ['Innopolis University'], '24767119700': ['Islamic University Medina']}","{'2020': '1', '2021': '5', '2022': '1'}"
85065636506,A novel approach for collecting and sharing software metrics data,Proceedings of the ACM Symposium on Applied Computing,2019-01-01,10.1145/3297280.3297625,Conference Proceeding,Conference Paper,3,"{'57208746906': ['Innopolis University'], '6602286710': ['Innopolis University']}",{'2020': '1'}
85064865863,An Architecture for Distributed Ledger-Based M2M Auditing for Electric Autonomous Vehicles,Advances in Intelligent Systems and Computing,2019-01-01,10.1007/978-3-030-15035-8_11,Book Series,Conference Paper,-1,"{'57208466926': ['Innopolis University'], '35324500900': ['Innopolis University'], '8557895400': ['Innopolis University'], '55303471000': ['Innopolis University'], '57202156203': ['Innopolis University'], '50262320700': ['Innopolis University']}","{'2019': '2', '2020': '2'}"
85064747201,Modeling and simulation of dynamic contact atomic force microscope,Lecture Notes in Mechanical Engineering,2019-01-01,10.1007/978-3-030-11981-2_10,Book Series,Book Chapter,4,"{'57197731584': ['Innopolis University'], '57203987223': ['Peter the Great St. Petersburg Polytechnic University']}","{'2020': '2', '2021': '3'}"
85063623272,Diagnostic principles of immature epileptic (proepileptic) EEG activity in rats with genetic predisposition to absence epilepsy,Informatsionno-Upravliaiushchie Sistemy,2019-01-01,10.31799/1684-8853-2019-1-89-97,Journal,Article,4,"{'6701547705': ['Institute of Higher Nervous Activity and Neurophysiology of RAS'], '57201796596': ['Institute of Higher Nervous Activity and Neurophysiology of RAS'], '54787609400': ['Innopolis University'], '6603156741': ['Innopolis University']}","{'2020': '2', '2021': '2'}"
85063481281,Road sign detection and localization based on camera and lidar data,Proceedings of SPIE - The International Society for Optical Engineering,2019-01-01,10.1117/12.2523155,Conference Proceeding,Conference Paper,4,"{'57188857896': ['Innopolis University'], '57193762276': ['Innopolis University'], '57207983234': ['Innopolis University']}","{'2020': '1', '2021': '2', '2022': '1'}"
85061105487,Teaching devops in corporate environments: An experience report,Lecture Notes in Computer Science (including subseries Lecture Notes in Artificial Intelligence and Lecture Notes in Bioinformatics),2019-01-01,10.1007/978-3-030-06019-0_8,Book Series,Conference Paper,4,"{'8557895400': ['Innopolis University'], '57190306849': ['Innopolis University'], '57190293089': ['Innopolis University'], '6602286710': ['Innopolis University'], '57205682151': ['Innopolis University']}","{'2019': '2', '2020': '4', '2021': '3'}"
85061100837,A lean and devops approach to teach lean software development,Lecture Notes in Computer Science (including subseries Lecture Notes in Artificial Intelligence and Lecture Notes in Bioinformatics),2019-01-01,10.1007/978-3-030-06019-0_15,Book Series,Conference Paper,4,"{'57195101229': ['Innopolis University'], '23393081800': ['Innopolis University'], '57195108870': ['Innopolis University'], '57205682636': ['Innopolis University'], '7004757466': ['Innopolis University']}",{'2021': '1'}
85061077288,Preface,Lecture Notes in Computer Science (including subseries Lecture Notes in Artificial Intelligence and Lecture Notes in Bioinformatics),2019-01-01,,Book Series,Editorial,4,"{'35232489400': ['Université Fédérale Toulouse Midi-Pyrénées'], '8557895400': ['Innopolis University'], '7402073082': ['Innopolis University', 'Politecnico di Milano']}",{}
85060870751,Intuitive rules design evaluation methods and case study,CEUR Workshop Proceedings,2019-01-01,,Conference Proceeding,Conference Paper,4,"{'55724408300': ['Innopolis University'], '57193924846': ['Innopolis University'], '57194571105': ['Innopolis University'], '7004757466': ['Innopolis University']}",{'2019': '1'}
85059907600,Cache aware user association for wireless heterogeneous networks,IEEE Access,2019-01-01,10.1109/ACCESS.2018.2885571,Journal,Article,2,"{'35107116200': ['Kyung Hee University'], '56783838600': ['Kyung Hee University', 'Innopolis University'], '56811684000': ['Kyung Hee University'], '26434126600': ['Kyung Hee University', 'BRAC University'], '56623778200': ['Kyung Hee University']}","{'2019': '6', '2020': '5', '2021': '6', '2022': '2'}"
85059886103,Stereo vision-based optimal path planning with stochastic maps for mobile robot navigation,Advances in Intelligent Systems and Computing,2019-01-01,10.1007/978-3-030-01370-7_4,Book Series,Conference Paper,-1,"{'57205404418': ['Innopolis University'], '57202156203': ['Innopolis University']}","{'2019': '1', '2022': '1'}"
85051496757,Advancement of MSA-Technique for Stiffness Modeling of Serial and Parallel Robotic Manipulators,"CISM International Centre for Mechanical Sciences, Courses and Lectures",2019-01-01,10.1007/978-3-319-78963-7_45,Book Series,Book Chapter,3,"{'37016245900': ['Innopolis University'], '6602989627': ['CNRS Centre National de la Recherche Scientifique', 'Laboratoire des Sciences du Numérique de Nantes'], '6701582655': ['Laboratoire des Sciences du Numérique de Nantes', 'IMT Atlantique']}","{'2018': '2', '2019': '2', '2020': '1', '2022': '1'}"
85061010185,Generation of motion patterns with turns for bipedal walking robot based on actuated 3D Dual-SLIP model,"2018 2nd School on Dynamics of Complex Networks and their Application in Intellectual Robotics, DCNAIR 2018",2018-12-26,10.1109/DCNAIR.2018.8589051,Conference Proceeding,Conference Paper,-1,"{'56895904700': ['Innopolis University'], '57205663201': ['Innopolis University'], '37016245900': ['Innopolis University'], '7006190065': ['Kazan Federal University']}",{}
85060999092,Stiffness Analysis for Anthropomorphic Platform,"2018 2nd School on Dynamics of Complex Networks and their Application in Intellectual Robotics, DCNAIR 2018",2018-12-26,10.1109/DCNAIR.2018.8589226,Conference Proceeding,Conference Paper,-1,"{'57206536564': ['Innopolis University'], '37016245900': ['Innopolis University']}",{'2019': '2'}
85060988560,Scenarios for Physical Robot-Environment Interaction,"2018 2nd School on Dynamics of Complex Networks and their Application in Intellectual Robotics, DCNAIR 2018",2018-12-26,10.1109/DCNAIR.2018.8589219,Conference Proceeding,Conference Paper,-1,"{'57206536564': ['Innopolis University'], '57203955171': ['Innopolis University'], '37016245900': ['Innopolis University']}",{}
85060791854,A New Machine Learning-based Collaborative DDoS Mitigation Mechanism in Software-Defined Network,"International Conference on Wireless and Mobile Computing, Networking and Communications",2018-12-26,10.1109/WiMOB.2018.8589104,Conference Proceeding,Conference Paper,-1,"{'57205620574': ['Innopolis University'], '35324500900': ['Innopolis University'], '6507216990': ['Innopolis University'], '57205612678': ['Innopolis University'], '50262320700': ['Innopolis University'], '55555819300': ['Ryerson University'], '56405671800': ['University of Gharadaia'], '19336759600': ['United Arab Emirates University'], '57203026622': ['Fordham University']}","{'2019': '2', '2020': '5', '2021': '5', '2022': '4'}"
85061053012,Advancement of Robots with Double Encoders for Industrial and Collaborative Applications,"Conference of Open Innovation Association, FRUCT",2018-12-24,10.23919/FRUCT.2018.8588021,Conference Proceeding,Conference Paper,-1,"{'57203955171': ['Innopolis University'], '57206536564': ['Innopolis University'], '57205663201': ['Innopolis University'], '37016245900': ['Innopolis University']}","{'2020': '2', '2021': '3', '2022': '1'}"
85061042972,Concept Development of Biomimetic Centipede Robot StriRus,"Conference of Open Innovation Association, FRUCT",2018-12-24,10.23919/FRUCT.2018.8587914,Conference Proceeding,Conference Paper,-1,"{'57195628246': ['Innopolis University'], '37016245900': ['Innopolis University']}",{}
85061039440,Variable Actuation Modes in Parallel Manipulators: Impact on the Stiffness Behavior,"Conference of Open Innovation Association, FRUCT",2018-12-24,10.23919/FRUCT.2018.8588031,Conference Proceeding,Conference Paper,-1,"{'37016245900': ['Innopolis University'], '6701582655': ['IMT Atlantique'], '6602989627': ['Laboratoire des Sciences du Numérique de Nantes']}",{}
85061029985,An Anomaly Detection Model for Enhancing Energy Management in Smart Buildings,"2018 IEEE International Conference on Communications, Control, and Computing Technologies for Smart Grids, SmartGridComm 2018",2018-12-24,10.1109/SmartGridComm.2018.8587597,Conference Proceeding,Conference Paper,-1,"{'36606049200': ['Innopolis University'], '6602286710': ['Innopolis University']}","{'2019': '1', '2020': '1', '2021': '2'}"
85060825344,Map Comparison of Lidar-based 2D SLAM Algorithms Using Precise Ground Truth,"2018 15th International Conference on Control, Automation, Robotics and Vision, ICARCV 2018",2018-12-18,10.1109/ICARCV.2018.8581131,Conference Proceeding,Conference Paper,-1,"{'57204765694': ['Innopolis University'], '57205614485': ['Innopolis University'], '57202156203': ['Innopolis University']}","{'2018': '1', '2019': '5', '2020': '13', '2021': '23', '2022': '5'}"
85060517988,Towards Multi-metric Cache Replacement Policies in Vehicular Named Data Networks,"IEEE International Symposium on Personal, Indoor and Mobile Radio Communications, PIMRC",2018-12-18,10.1109/PIMRC.2018.8580741,Conference Proceeding,Conference Paper,-1,"{'57498982400': ['Innopolis University'], '26029621100': ['Innopolis University'], '35324500900': ['Innopolis University'], '24780719300': ['Daegu Gyeongbuk Institute of Science and Technology'], '50262320700': ['Innopolis University'], '57195397350': ['Alpen-Adria-Universität Klagenfurt'], '55389144500': ['Georgia Southern University'], '7005984674': [""Université d'Avignon et des Pays du Vaucluse""]}","{'2020': '8', '2021': '6', '2022': '1'}"
