id,title,publisher,publication_date,doi,source_type,work_type,source_quartile,authors_affils,citations
85110271637,Recurrence quantification analysis provides the link between age-related decline in motor brain response and complexity of the baseline EEG,Izvestiya Vysshikh Uchebnykh Zavedeniy. Prikladnaya Nelineynaya Dinamika,2021-01-01,10.18500/0869-6632-2021-29-3-386-397,Journal,Article,4,{'57192586726': ['Innopolis University']},{}
85110266325,Mathematical model and dynamical analysis of the human equilibrium seeking training,Izvestiya Vysshikh Uchebnykh Zavedeniy. Prikladnaya Nelineynaya Dinamika,2021-01-01,10.18500/0869-6632-2021-29-3-409-420,Journal,Article,4,"{'55241932000': ['Innopolis University'], '54787609400': ['Innopolis University'], '56359138000': ['Innopolis University']}",{}
85110063477,Non-contact atomic force microscope: Modeling and simulation using van der pol averaging method,Izvestiya Vysshikh Uchebnykh Zavedeniy. Prikladnaya Nelineynaya Dinamika,2021-01-01,10.18500/0869-6632-2021-29-3-345-355,Journal,Article,4,{'57197731584': ['Innopolis University']},{}
85108964112,Learning Deep Attention Network from Incremental and Decremental Features for Evolving Features,Scientific Programming,2021-01-01,10.1155/2021/1492828,Journal,Article,3,"{'57219554227': ['Hebei University of Environmental Engineering'], '57219553907': ['Innopolis University']}",{'2021': '1'}
85108545462,Control Algorithm for Compensated Tripod-Based Manipulators,Lecture Notes in Mechanical Engineering,2021-01-01,10.1007/978-3-030-54817-9_71,Book Series,Conference Paper,4,"{'6603217784': ['Volgograd State Technical University', 'Innopolis University'], '56593193500': ['Federal State Educational Institution of Higher Education, Volgograd State Agricultural University'], '57224900670': ['Federal State Educational Institution of Higher Education, Volgograd State Agricultural University']}",{}
85107362370,Experimental platform to study spiking pattern propagation in modular networks in vitro,Brain Sciences,2021-01-01,10.3390/brainsci11060717,Journal,Article,3,"{'57035413100': ['Lobachevsky State University of Nizhni Novgorod'], '55696429000': ['Lobachevsky State University of Nizhni Novgorod', 'Privolzhsky Research Medical University'], '57191381002': ['Lobachevsky State University of Nizhni Novgorod'], '55263161500': ['Privolzhsky Research Medical University'], '52363325000': ['St Petersburg National Research Academic University of the Russian Academy of Sciences', 'Institute for Analytical Instrumentation of the Russian Academy of Sciences'], '7005605401': ['Lobachevsky State University of Nizhni Novgorod', 'Innopolis University', 'Immanuel Kant Baltic Federal University'], '56165145700': ['Lobachevsky State University of Nizhni Novgorod']}",{'2021': '1'}
85107177887,A Novel Contract Theory-Based Incentive Mechanism for Cooperative Task-Offloading in Electrical Vehicular Networks,IEEE Transactions on Intelligent Transportation Systems,2021-01-01,10.1109/TITS.2021.3078913,Journal,Article,1,"{'56783838600': ['University of the West of England'], '57188865186': ['Kyung Hee University'], '56045308100': ['Khalifa University of Science and Technology'], '57200272286': ['Kyung Hee University'], '35324500900': ['Innopolis University'], '16679109100': ['Innopolis University'], '56623778200': ['Kyung Hee University'], '35617663600': ['Khalifa University of Science and Technology']}",{'2022': '3'}
85106449146,Towards a Secure Smart Parking Solution for Business Entities,Lecture Notes in Networks and Systems,2021-01-01,10.1007/978-3-030-75078-7_47,Book Series,Conference Paper,4,"{'57221395702': ['Innopolis University'], '8557895400': ['Innopolis University']}",{'2021': '1'}
85106422731,A Survey on Data Science Techniques for Predicting Software Defects,Lecture Notes in Networks and Systems,2021-01-01,10.1007/978-3-030-75078-7_31,Book Series,Conference Paper,4,"{'57213145511': ['Innopolis University'], '57224830085': ['Innopolis University'], '57194583034': ['Innopolis University'], '57213143037': ['Innopolis University'], '57219758793': ['Innopolis University'], '8557895400': ['Innopolis University']}","{'2021': '1', '2022': '1'}"
85106419407,Automatically Injecting Semantic Annotations into Online Articles,Lecture Notes in Networks and Systems,2021-01-01,10.1007/978-3-030-75078-7_61,Book Series,Conference Paper,4,"{'57212008716': ['Innopolis University'], '8557895400': ['Innopolis University'], '8723952700': ['American University in the Emirates']}",{}
85106416182,Survey on Blockchain Applications for Healthcare: Reflections and Challenges,Lecture Notes in Networks and Systems,2021-01-01,10.1007/978-3-030-75078-7_32,Book Series,Conference Paper,4,"{'57216589339': ['Innopolis University'], '57212008716': ['Innopolis University'], '57221393505': ['Innopolis University'], '8557895400': ['Innopolis University'], '57193924846': ['Innopolis University'], '40661326300': ['Innopolis University'], '57197731584': ['Innopolis University'], '55232255600': ['Innopolis University']}",{'2022': '1'}
85106203279,Modeling of Movement of Electrical Transmission Line Robot Inspector Through Bond Graph,Lecture Notes in Mechanical Engineering,2021-01-01,10.1007/978-3-030-54814-8_76,Book Series,Conference Paper,4,{'57197731584': ['Innopolis University']},{}
85106145121,Modeling of Motion of Electrical Transmission Line Robot Inspector,Lecture Notes in Mechanical Engineering,2021-01-01,10.1007/978-3-030-54814-8_97,Book Series,Conference Paper,4,{'57197731584': ['Innopolis University']},{}
85105950736,Root Causes of Interaction Issues in Agile Software Development Teams: Status and Perspectives,Advances in Intelligent Systems and Computing,2021-01-01,10.1007/978-3-030-73103-8_74,Book Series,Conference Paper,-1,"{'7004218817': ['Alma Mater Studiorum Università di Bologna', 'Innopolis University'], '40661326300': ['Innopolis University'], '57205682636': ['Innopolis University'], '7004757466': ['Innopolis University'], '57212244943': ['Innopolis University'], '57218227694': ['Innopolis University']}","{'2021': '2', '2022': '1'}"
85105941683,TeleML: Deploying Trained Machine Learning Models in Cross-Platform Applications,Lecture Notes in Networks and Systems,2021-01-01,10.1007/978-3-030-75075-6_27,Book Series,Conference Paper,4,"{'57219963221': ['Innopolis University'], '57222815355': ['Innopolis University'], '8557895400': ['Innopolis University']}",{}
85105037346,Non Verbal Communication in Software Engineering-An Empirical Study,IEEE Access,2021-01-01,10.1109/ACCESS.2021.3075983,Journal,Article,2,"{'7004218817': ['Alma Mater Studiorum Università di Bologna'], '40661326300': ['Innopolis University'], '57205682636': ['Innopolis University'], '7004757466': ['Innopolis University'], '57212244943': ['Innopolis University'], '57218227694': ['Innopolis University']}","{'2021': '3', '2022': '3'}"
85104807259,RuREBus: A Case Study of Joint Named Entity Recognition and Relation Extraction from E-Government Domain,Lecture Notes in Computer Science (including subseries Lecture Notes in Artificial Intelligence and Lecture Notes in Bioinformatics),2021-01-01,10.1007/978-3-030-72610-2_2,Book Series,Conference Paper,4,"{'57219553433': ['ABBYY', 'Moscow Institute of Physics and Technology'], '57219525287': ['HSE University'], '22333805300': ['Novosibirsk State University', 'Lomonosov Moscow State University'], '57195101229': ['Innopolis University', 'Lomonosov Moscow State University'], '57214241722': ['HSE University'], '56441621500': ['Kazan Federal University', 'Lomonosov Moscow State University'], '56292341700': ['ABBYY', 'Moscow Institute of Physics and Technology']}",{}
85104770512,Comparison of Machine Learning Methods for Life Trajectory Analysis in Demography,Lecture Notes in Computer Science (including subseries Lecture Notes in Artificial Intelligence and Lecture Notes in Bioinformatics),2021-01-01,10.1007/978-3-030-73280-6_50,Book Series,Conference Paper,4,"{'57021469000': ['HSE University'], '57021862500': ['HSE University'], '57204511939': ['HSE University', 'Innopolis University']}",{}
85104706606,Machine Learning and Value Generation in Software Development: A Survey,Communications in Computer and Information Science,2021-01-01,10.1007/978-3-030-71472-7_3,Book Series,Conference Paper,4,"{'57219758793': ['Innopolis University'], '57194583034': ['Innopolis University'], '57211155307': ['Innopolis University'], '57217089949': ['Innopolis University'], '57217088924': ['Innopolis University'], '16679109100': ['Innopolis University'], '8557895400': ['Innopolis University'], '57219760171': ['Innopolis University'], '57219763307': ['Innopolis University']}",{'2021': '1'}
85104472662,Rooting Formal Methods Within Higher Education Curricula for Computer Science and Software Engineering — A White Paper —,Communications in Computer and Information Science,2021-01-01,10.1007/978-3-030-71374-4_1,Book Series,Conference Paper,4,"{'57193048432': ['Nazarbayev University'], '8698016500': ['Swansea University'], '7102649878': ['University of Bath'], '57221153608': ['Swansea University'], '57206178327': ['The University of Manchester'], '6603210447': ['Universitetet i Bergen'], '56235197000': ['Swansea University'], '57190128306': ['Heinrich-Heine-Universität Düsseldorf'], '55891457900': ['Hochschule Niederrhein'], '6507887998': ['Universitetet i Oslo'], '24475478100': ['Humboldt-Universität zu Berlin'], '57211877255': ['Innopolis University'], '57221078038': ['Nazarbayev University']}",{}
85104435349,Fun with Formal Methods for Better Education,Communications in Computer and Information Science,2021-01-01,10.1007/978-3-030-71374-4_4,Book Series,Conference Paper,4,"{'57211877255': ['Innoplolis University'], '57223015455': ['Innoplolis University'], '57190340999': ['Innoplolis University']}",{}
85104403895,Wind turbine data analysis and lstm-based prediction in scada system,Energies,2021-01-01,10.3390/en14010125,Journal,Article,2,"{'57223800851': ['Innopolis University'], '36606049200': ['Innopolis University']}","{'2021': '8', '2022': '7'}"
85103407228,Multi-agent shape models for hip landmark detection in MR scans,Progress in Biomedical Optics and Imaging - Proceedings of SPIE,2021-01-01,10.1117/12.2580862,Conference Proceeding,Conference Paper,4,"{'57209140202': ['Innopolis University'], '57222651064': ['Innopolis University', 'Sirius University of Science and Technology', 'Public Hospital 2'], '6507696809': ['Univerza v Ljubljani'], '22134759700': ['Innopolis University', 'Sirius University of Science and Technology'], '40761505000': ['Innopolis University', 'Københavns Universitet']}","{'2021': '2', '2022': '2'}"
85103388309,Adversarial Reconstruction Loss for Domain Generalization,IEEE Access,2021-01-01,10.1109/ACCESS.2021.3066041,Journal,Article,2,"{'57209140202': ['Sorbonne Universite'], '57222147670': ['Academia Româna'], '16679109100': ['Innopolis University'], '56783838600': ['Innopolis University'], '26031517700': ['Zayed University'], '40761505000': ['Innopolis University', 'Københavns Universitet']}",{'2022': '2'}
85103273343,Improving the courses of educational programs on information security smart grid,CEUR Workshop Proceedings,2021-01-01,,Conference Proceeding,Conference Paper,4,"{'57206722125': ['V.I. Vernadsky Crimean Federal University'], '57200259298': ['V.I. Vernadsky Crimean Federal University'], '57195327289': ['Innopolis University']}",{'2021': '1'}
85103245307,Platform for testing and dynamic control of software code based on dimensions,CEUR Workshop Proceedings,2021-01-01,,Conference Proceeding,Conference Paper,4,"{'57195327289': ['Innopolis University'], '57222571092': ['MIREA - Russian Technological University (RTU MIREA)'], '57200259298': ['V.I. Vernadsky Crimean Federal University'], '57206722125': ['V.I. Vernadsky Crimean Federal University'], '57222579511': ['V.I. Vernadsky Crimean Federal University']}",{}
85103204777,Adversarial Reconstruction Loss for Domain Generalization,IEEE Access,2021-01-01,10.1109/ACCESS.2021.3066041,Journal,Article,2,"{'57209140202': ['Sorbonne Universite'], '57222147670': ['Academia Româna'], '16679109100': ['Innopolis University'], '56783838600': ['Innopolis University'], '26031517700': ['Zayed University'], '40761505000': ['Innopolis University']}",{}
85101825179,A Comprehensive Survey on Moving Networks,IEEE Communications Surveys and Tutorials,2021-01-01,10.1109/COMST.2020.3029005,Journal,Article,1,"{'57193864496': [""Xi'an Jiaotong-Liverpool University""], '35324500900': ['Innopolis University'], '55809927400': ['Massey University'], '56362681400': ['Massey University']}","{'2021': '6', '2022': '5'}"
85101352328,Method for Fault Identification in Nonlinear Systems Based on Sliding-Mode Observers,Journal of Computer and Systems Sciences International,2021-01-01,10.1134/S1064230721010147,Journal,Article,4,"{'7003985569': ['Far Eastern Federal University', 'Institute of Marine Technology Problems, Far Eastern Branch, Russian Academy of Sciences'], '24924111800': ['Institute of Marine Technology Problems, Far Eastern Branch, Russian Academy of Sciences', 'Innopolis University'], '57222086769': ['Far Eastern Federal University']}",{'2022': '1'}
85100770223,Long-term progress and behavior complexification in competitive coevolution,Artificial Life,2021-01-01,10.1162/artl_a_00329,Journal,Article,3,"{'36503007000': ['CNR-ISTC'], '56231750100': ['CNR-ISTC Innopolis University']}",{}
85099278207,Development of multiple behaviors in evolving robots,Robotics,2021-01-01,10.3390/robotics10010001,Journal,Article,2,"{'57205060820': ['Innopolis University'], '56231750100': ['Innopolis University', 'Istituto Di Scienze E Tecnologie Della Cognizione, Rome']}",{'2021': '1'}
85099053291,Event-related coherence in visual cortex and brain noise: An meg study,Applied Sciences (Switzerland),2021-01-01,10.3390/app11010375,Journal,Article,2,"{'57202377690': ['Centro de Tecnología Biomédica'], '35334432000': ['Innopolis University'], '6603156741': ['Innopolis University'], '7005864666': ['Centro de Tecnología Biomédica', 'Innopolis University']}","{'2021': '10', '2022': '1'}"
85098572360,On the Role of Hash-Based Signatures in Quantum-Safe Internet of Things: Current Solutions and Future Directions,IEEE Internet of Things Journal,2021-01-01,10.1109/JIOT.2020.3013019,Journal,Article,1,"{'55934138000': ['Kyung Hee University'], '35324500900': ['Innopolis University'], '55209201300': ['Aberystwyth University'], '56623778200': ['Kyung Hee University']}","{'2021': '7', '2022': '6'}"
85097384196,Mechanical Challenges of Inspection Robot Moving Along the Electrical Line: Effect of Flexural Rigidity,Lecture Notes in Mechanical Engineering,2021-01-01,10.1007/978-3-030-62062-2_4,Book Series,Conference Paper,4,{'57197731584': ['Innopolis University']},{}
85097203166,Photonic Crystal as a Section of Modulation and Interaction with a Virtual Cathode in Two-Section Vircator,IEEE Transactions on Electron Devices,2021-01-01,10.1109/TED.2020.3037278,Journal,Article,1,"{'56359138000': ['Innopolis University'], '57197756291': ['Innopolis University'], '35334432000': ['Innopolis University']}",{'2022': '2'}
85095787853,Multi robots interactive control using mixed reality,International Journal of Production Research,2021-01-01,10.1080/00207543.2020.1834640,Journal,Article,1,"{'57203783042': ['Innopolis University'], '57204765694': ['Innopolis University'], '57219857818': ['Innopolis University'], '57210233068': ['Innopolis University'], '37016245900': ['Innopolis University']}",{'2022': '1'}
85092404959,Stiffness Modeling of Planar Robotic Manipulators: Model Reduction and Identifiability of Parameters,"CISM International Centre for Mechanical Sciences, Courses and Lectures",2021-01-01,10.1007/978-3-030-58380-4_57,Book Series,Book Chapter,3,"{'57205663201': ['Innopolis University'], '57206536564': ['Innopolis University'], '57203955171': ['Innopolis University'], '37016245900': ['Innopolis University'], '6701582655': ['IMT Atlantique', 'Laboratoire des Sciences du Numérique de Nantes']}",{}
85091136666,Linearization-based forward kinematic algorithm for tensegrity structures with compressible struts,"Smart Innovation, Systems and Technologies",2021-01-01,10.1007/978-981-15-5580-0_24,Book Series,Conference Paper,4,"{'55978984900': ['Innopolis University'], '57211524628': ['Innopolis University'], '35364441900': ['Innopolis University']}",{'2021': '2'}
85090169509,Abstraction-Based Outlier Detection for Image Data,Advances in Intelligent Systems and Computing,2021-01-01,10.1007/978-3-030-55180-3_40,Book Series,Conference Paper,-1,"{'57218715680': ['Innopolis University'], '57209140202': ['Innopolis University'], '16679109100': ['Innopolis University'], '26031517700': ['Zayed University']}","{'2020': '1', '2021': '4', '2022': '2'}"
85059027049,Microservices: Migration of a Mission Critical System,IEEE Transactions on Services Computing,2021-01-01,10.1109/TSC.2018.2889087,Journal,Article,1,"{'8557895400': ['Innopolis University'], '8308455900': ['Technical University of Denmark'], '13105059800': ['Örebro Universitet'], '57200137930': ['Bruno Kessler Foundation'], '57200579924': ['Örebro Universitet'], '6701473617': ['Danske Bank', 'TU Wien']}","{'2019': '1', '2020': '1', '2021': '1'}"
85099057655,Influence of listening to music on emotional state of programmers: Preliminary study,Journal of Physics: Conference Series,2020-12-28,10.1088/1742-6596/1694/1/012013,Conference Proceeding,Conference Paper,4,"{'57212001787': ['Innopolis University'], '57210745306': ['Innopolis University']}",{}
85099055402,A Survey of Blockchain Solutions for Autonomous Vehicles Ecosystems,Journal of Physics: Conference Series,2020-12-28,10.1088/1742-6596/1694/1/012024,Conference Proceeding,Conference Paper,4,"{'57216589339': ['Innopolis University'], '57212008716': ['Innopolis University'], '57221393505': ['Innopolis University'], '8557895400': ['Innopolis University']}","{'2021': '1', '2022': '1'}"
85099044948,Software Development Life Cycle early phases and quality metrics: A Systematic Literature Review,Journal of Physics: Conference Series,2020-12-28,10.1088/1742-6596/1694/1/012007,Conference Proceeding,Conference Paper,4,"{'57213161890': ['Innopolis University'], '57216030902': ['Innopolis University']}","{'2021': '1', '2022': '1'}"
85099044313,Good practices for the adoption of DataOps in the software industry,Journal of Physics: Conference Series,2020-12-28,10.1088/1742-6596/1694/1/012032,Conference Proceeding,Conference Paper,4,"{'57224830085': ['Innopolis University'], '57194583034': ['Innopolis University'], '8557895400': ['Innopolis University']}",{}
85099040167,Pattern Matching-based scraping of news websites,Journal of Physics: Conference Series,2020-12-28,10.1088/1742-6596/1694/1/012011,Conference Proceeding,Conference Paper,4,"{'57212008716': ['Innopolis University'], '8557895400': ['Innopolis University']}",{'2021': '4'}
85099035567,Preliminary result on how to enhance online education during the COVID-19 pandemic,Journal of Physics: Conference Series,2020-12-28,10.1088/1742-6596/1694/1/012021,Conference Proceeding,Conference Paper,4,{'57221400469': ['Innopolis University']},{}
85099032575,ML-based Telegram bot for real estate price prediction,Journal of Physics: Conference Series,2020-12-28,10.1088/1742-6596/1694/1/012010,Conference Proceeding,Conference Paper,4,"{'57212008716': ['Innopolis University'], '8557895400': ['Innopolis University']}",{}
85099023765,"VII-th International Young Scientists Conference on Information Technologies, Telecommunications and Control Systems",Journal of Physics: Conference Series,2020-12-28,10.1088/1742-6596/1694/1/011001,Conference Proceeding,Editorial,4,"{'57216030902': ['Innopolis University'], '57221399180': ['Ural Federal University']}",{}
85098956431,Voluntary and Involuntary Attention in Bistable Visual Perception: A MEG Study,Frontiers in Human Neuroscience,2020-12-22,10.3389/fnhum.2020.597895,Journal,Article,3,"{'57202377690': ['Universidad Politécnica de Madrid'], '56572360300': ['Innolpolis University'], '6603156741': ['Innolpolis University', 'Saratov State Medical University named after V. I. Razumovsky'], '7005864666': ['Universidad Politécnica de Madrid', 'Innolpolis University']}","{'2021': '5', '2022': '1'}"
85089553785,Generation of giant periodic pulses in the array of erbium-doped fiber lasers by controlling multistability,Optics Communications,2020-12-15,10.1016/j.optcom.2020.126355,Journal,Article,2,"{'8941071700': ['Universidad de Guadalajara'], '57218550943': ['Universidad de Guadalajara'], '57196778740': ['Universidad de Guadalajara'], '56002769300': ['Universidad de Guadalajara'], '7004559562': ['Centro de Investigaciones en Optica, A.C.'], '7005864666': ['Universidad Politécnica de Madrid', 'Innopolis University']}",{'2021': '1'}
85100755261,Emotion Recognition on large video dataset based on Convolutional Feature Extractor and Recurrent Neural Network,"4th International Conference on Image Processing, Applications and Systems, IPAS 2020",2020-12-09,10.1109/IPAS50080.2020.9334935,Conference Proceeding,Conference Paper,-1,"{'57219789697': ['Innopolis University'], '36606049200': ['Innopolis University']}",{'2021': '1'}
85103305286,Accuracy Analysis of a Ground Reaction Predictor-based Feedforward Control,"2020 International Conference Nonlinearity, Information and Robotics, NIR 2020",2020-12-03,10.1109/NIR50484.2020.9290230,Conference Proceeding,Conference Paper,-1,{'55978984900': ['Innopolis University']},{}
85103302872,Companion AI for Starbound Game Using Utility Theory,"2020 International Conference Nonlinearity, Information and Robotics, NIR 2020",2020-12-03,10.1109/NIR50484.2020.9290164,Conference Proceeding,Conference Paper,-1,"{'57222579692': ['Innopolis University'], '55724408300': ['Innopolis University']}",{}
85103302746,Chimera-like state in ensemble of bistable neurons,"2020 International Conference Nonlinearity, Information and Robotics, NIR 2020",2020-12-03,10.1109/NIR50484.2020.9290204,Conference Proceeding,Conference Paper,-1,"{'57197756291': ['Innopolis University'], '16498801300': ['Innopolis University'], '57204939326': ['Saratov State University'], '57216647540': ['Saratov State University']}",{}
85103289786,Network analysis of electrical activity in brain motor cortex during motor execution and motor imagery of elderly,"2020 International Conference Nonlinearity, Information and Robotics, NIR 2020",2020-12-03,10.1109/NIR50484.2020.9290219,Conference Proceeding,Conference Paper,-1,"{'57192586726': ['Innopolis University'], '16498801300': ['Innopolis University'], '56359138000': ['Innopolis University'], '54787609400': ['Innopolis University']}",{'2021': '1'}
85103288796,Features of real and imaginary human motor activity with EEG and fNIRS,"2020 International Conference Nonlinearity, Information and Robotics, NIR 2020",2020-12-03,10.1109/NIR50484.2020.9290202,Conference Proceeding,Conference Paper,-1,"{'54787609400': ['Innopolis University'], '56359138000': ['Innopolis University'], '16498801300': ['Innopolis University'], '57192586726': ['Innopolis University']}",{}
85103282890,Attention state of children during Schulte tables task,"2020 International Conference Nonlinearity, Information and Robotics, NIR 2020",2020-12-03,10.1109/NIR50484.2020.9290231,Conference Proceeding,Conference Paper,-1,"{'54787609400': ['Innopolis University'], '56572360300': ['Innopolis University'], '35334432000': ['Innopolis University'], '56572729200': ['Saratov State University'], '57204939326': ['Saratov State University'], '6603156741': ['Innopolis University']}",{}
85103282347,Application of CycleGAN-based Augmentation for Autonomous Driving at Night,"2020 International Conference Nonlinearity, Information and Robotics, NIR 2020",2020-12-03,10.1109/NIR50484.2020.9290218,Conference Proceeding,Conference Paper,-1,"{'57208863826': ['Innopolis University'], '57204765694': ['Innopolis University'], '57209073038': ['Innopolis University'], '56088205500': ['Innopolis University']}",{'2021': '2'}
85103281352,Stabilization of a spherical robot rolling on an oscillating underlying surface,"2020 International Conference Nonlinearity, Information and Robotics, NIR 2020",2020-12-03,10.1109/NIR50484.2020.9290225,Conference Proceeding,Conference Paper,-1,"{'55929738700': ['Kalashnikov Izhevsk State Technical University'], '6602549842': ['Innopolis University'], '55929695900': ['Udmurt State University'], '56105346800': ['Udmurt State University']}",{}
85103279228,Path Planning Followed by Kinodynamic Smoothing for Multirotor Aerial Vehicles (MAVs),"2020 International Conference Nonlinearity, Information and Robotics, NIR 2020",2020-12-03,10.1109/NIR50484.2020.9290162,Conference Proceeding,Conference Paper,-1,"{'57193419633': ['Innopolis University'], '57219857818': ['Innopolis University'], '55692229600': ['Innopolis University'], '55978984900': ['Innopolis University'], '37016245900': ['Innopolis University']}",{'2022': '1'}
85103271983,Workspace Analysis of Tensegrity Structures with an Iterative Energy-based Algorithm,"2020 International Conference Nonlinearity, Information and Robotics, NIR 2020",2020-12-03,10.1109/NIR50484.2020.9290196,Conference Proceeding,Conference Paper,-1,"{'55978984900': ['Innopolis University'], '57211524628': ['Innopolis University'], '37016245900': ['Innopolis University']}",{}
85103269306,Method for measuring differences in the neuronal responses to social stimuli,"2020 International Conference Nonlinearity, Information and Robotics, NIR 2020",2020-12-03,10.1109/NIR50484.2020.9290233,Conference Proceeding,Conference Paper,-1,{'57454775900': ['Innopolis University']},{}
